,pullid,pulls_number,pulltitle,pullsbody,pullsuserlogin,pullsuserid,pullauthordate,author_association,merged_status,stats_addns,stats_delns,stats_changed_files,pull_repo_desc,pull_repo_lang,pull_commit_sha,pull_commit_message
0,https://api.github.com/repos/mozilla/makeapi-docs/pulls/6,6,Add Mozilla Code of Conduct,"Fixes #5


As of January 1 2019, Mozilla requires that all GitHub projects include this [CODE_OF_CONDUCT.md](https://github.com/mozilla/repo-templates/blob/master/templates/CODE_OF_CONDUCT.md) file in the project root. The file has two parts:

1. Required Text - All text under the headings *Community Participation Guidelines and How to Report*, are required, and should not be altered.
2. Optional Text - The Project Specific Etiquette heading provides a space to speak more specifically about ways people can work effectively and inclusively together. Some examples of those can be found on the [Firefox Debugger](https://github.com/devtools-html/debugger.html/blob/master/CODE_OF_CONDUCT.md) project, and [Common Voice](https://github.com/mozilla/voice-web/blob/master/CODE_OF_CONDUCT.md). (The optional part is commented out in the [raw template file](https://raw.githubusercontent.com/mozilla/repo-templates/blob/master/templates/CODE_OF_CONDUCT.md), and will not be visible until you modify and uncomment that part.)

If you have any questions about this file, or Code of Conduct policies and procedures, please see [Mozilla-GitHub-Standards](https://wiki.mozilla.org/GitHub/Repository_Requirements) or email Mozilla-GitHub-Standards+CoC@mozilla.com.

_(Message COC002)_",Mozilla-GitHub-Standards,48073334,2019-03-29T04:57:30Z,NONE,False,15,0,1,Documentation for the MakeAPI and MakeAPI client using Jekyll,CSS,fc504d9563da22aedebaa39719bf8df0277ad8a7,"Add Mozilla Code of Conduct file

Fixes #5.

_(Message COC002)_"
1,https://api.github.com/repos/mozilla/makeapi-docs/pulls/4,4,fix docs for any() and all() make search methods.,,cadecairos,438003,2015-01-19T20:54:51Z,CONTRIBUTOR,False,64,23,2,Documentation for the MakeAPI and MakeAPI client using Jekyll,CSS,a9d001bc61728b5f2fe08f433d19d4d5f4b77ac5,update docs
2,https://api.github.com/repos/mozilla/makeapi-docs/pulls/3,3,makeapi-angular docs,,errietta,134585,2014-09-08T22:25:24Z,CONTRIBUTOR,True,153,0,8,Documentation for the MakeAPI and MakeAPI client using Jekyll,CSS,96976400e773d35c4026d34d5ebc3ee094f3b6df,makeapi-angular docs
3,https://api.github.com/repos/mozilla/makeapi-docs/pulls/2,2,Bug 1049186 - fix install and configure links,,errietta,134585,2014-08-07T18:36:57Z,CONTRIBUTOR,False,2,2,1,Documentation for the MakeAPI and MakeAPI client using Jekyll,CSS,32fb6c81f5c22867616911878aaaa91f48634ad8,Bug 1049186 - fix install and configure links
4,https://api.github.com/repos/mozilla/makeapi-docs/pulls/1,1,Bug 1007114 - Add docs for matchAny and find,,cadecairos,438003,2014-06-25T16:52:01Z,CONTRIBUTOR,True,145,1,2,Documentation for the MakeAPI and MakeAPI client using Jekyll,CSS,bf06d97503ab6fbc322127ea2ebfbb4ed17ab0a0,Bug 1007114 - Add docs for matchAny and find
