,pullid,pulls_number,pulltitle,pullsbody,pullsuserlogin,pullsuserid,pullauthordate,author_association,merged_status,stats_addns,stats_delns,stats_changed_files,pull_repo_desc,pull_repo_lang,pull_commit_sha,pull_commit_message
0,https://api.github.com/repos/mozilla/fxtestbot/pulls/10,10,Fix tests for latest version of hubot-test-helper and lock dependencies,,davehunt,122800,2018-06-25T22:51:45Z,MEMBER,True,2491,2,3,No longer maintained,CoffeeScript,f0c2b5b46eb2f54aeda17ae62abad58ece5c50de,Fix tests for latest version of hubot-test-helper and lock dependencies
1,https://api.github.com/repos/mozilla/fxtestbot/pulls/9,9,Pin the version of node used by Travis CI,,davehunt,122800,2018-06-25T21:13:39Z,MEMBER,False,2541,3,2,No longer maintained,CoffeeScript,325b3021ce6ee46550d7333fcbdddb31d903d1fb,Pin the version of node used by Travis CI
2,https://api.github.com/repos/mozilla/fxtestbot/pulls/9,9,Pin the version of node used by Travis CI,,davehunt,122800,2018-06-25T21:13:39Z,MEMBER,False,2541,3,2,No longer maintained,CoffeeScript,1e89554566e99c4bc651652622e29b76cc8bbabf,Lock packages
3,https://api.github.com/repos/mozilla/fxtestbot/pulls/8,8,Remove announcement for Automationeers meeting,This event no longer occurs on a regular schedule. Commenting out the reminder instead of removing it so it can be used as a reference for future schedules.,davehunt,122800,2018-06-25T17:18:18Z,MEMBER,True,12,12,1,No longer maintained,CoffeeScript,9442b73b1e666a89c0eaf8bb3c5be19d51965ceb,"Remove announcement for Automationeers meeting
This event no longer occurs on a regular schedule. Commenting out the reminder instead of removing it so it can be used as a reference for future schedules."
4,https://api.github.com/repos/mozilla/fxtestbot/pulls/7,7,Update dependencies and engines,,davehunt,122800,2017-11-30T15:45:52Z,MEMBER,True,11,16,2,No longer maintained,CoffeeScript,6b10e8cf780df1b9c6e0aa8a762a0481c7c06a67,Update dependencies and engines
5,https://api.github.com/repos/mozilla/fxtestbot/pulls/6,6,"Add blurb about setting content-type to application/json, for webhook","

@karlht r?",stephendonner,387249,2017-11-29T20:56:45Z,CONTRIBUTOR,True,2,2,1,No longer maintained,CoffeeScript,eecbc53a9012e1ab21f875e13c30174d1487d411,"Add blurb about setting content-type to application/json, for webhook URL"
6,https://api.github.com/repos/mozilla/fxtestbot/pulls/5,5,Updated welcome link to point to RTD,,rbillings,737878,2017-05-11T17:15:09Z,COLLABORATOR,True,1,1,1,No longer maintained,CoffeeScript,336d267fc07a921218e4acf56e30a81642518dda,Updated welcome link to point to RTD
7,https://api.github.com/repos/mozilla/fxtestbot/pulls/4,4,Fix Automationeer event so it is only announced on the first Wednesday,D'oh! Fixed this to check the day of the month is < 7 (first Wednesday) rather than day of the week! Sorry for the channel noise @stephendonner and @rbillings...,davehunt,122800,2017-04-13T09:57:16Z,MEMBER,True,1,5,4,No longer maintained,CoffeeScript,ca4ced0e53e5673f4a48840860480c0900fe8430,Fix Automationeer event so it is only announced on the first Wednesday
8,https://api.github.com/repos/mozilla/fxtestbot/pulls/3,3,Made event announcements more generic,"* Removed cron for team meeting announcement
* Removed meeting command for team meeting details
* Added announcement for Automationeers Assemble event",davehunt,122800,2017-04-06T17:04:13Z,MEMBER,True,18,38,4,No longer maintained,CoffeeScript,27e2271ce875a0f41356d3b5745a3583cfe84c94,"Made event announcements more generic.

Removed cron for team meeting announcement.
Removed meeting command for team meeting details.
Added announcement for Automationeers Assemble event."
