,pullid,pulls_number,pulltitle,pullsbody,pullsuserlogin,pullsuserid,pullauthordate,author_association,merged_status,stats_addns,stats_delns,stats_changed_files,pull_repo_desc,pull_repo_lang,pull_commit_sha,pull_commit_message
0,https://api.github.com/repos/mozilla/mozilla-depends/pulls/10,10,detectors: handle empty list retirejs JSON output,fixes #9,g-k,226605,2019-07-18T20:53:55Z,CONTRIBUTOR,True,1,1,1,,Python,b01c593d33a5ec40c04004f1b0e76936f57ed137,"detectors: handle empty list retirejs JSON output

fixes #9"
1,https://api.github.com/repos/mozilla/mozilla-depends/pulls/8,8,readme: add test python deps and graphviz requirement,Add a couple notes about things I had to install to get mozilla-depends working.,g-k,226605,2019-07-18T20:34:01Z,CONTRIBUTOR,True,6,4,2,,Python,91797b5966f823604bd10dcf21015a186356808d,readme: add test python deps and graphviz requirement
2,https://api.github.com/repos/mozilla/mozilla-depends/pulls/8,8,readme: add test python deps and graphviz requirement,Add a couple notes about things I had to install to get mozilla-depends working.,g-k,226605,2019-07-18T20:34:01Z,CONTRIBUTOR,True,6,4,2,,Python,63233fdba5e92745acc38aa90eb1f50e0d7637f5,setup.py: add pytest-codestyle to TESTS_REQUIRE
3,https://api.github.com/repos/mozilla/mozilla-depends/pulls/7,7,Porting remaining code to networkx backend,,cr,170331,2019-07-15T16:29:26Z,CONTRIBUTOR,True,372,546,14,,Python,92c6e4c075460f4abe2f7a900f6a042a3029f744,Porting remaining code to networkx backend
