,pullid,pulls_number,pulltitle,pullsbody,pullsuserlogin,pullsuserid,pullauthordate,author_association,merged_status,stats_addns,stats_delns,stats_changed_files,pull_repo_desc,pull_repo_lang,pull_commit_sha,pull_commit_message
0,https://api.github.com/repos/mozilla/mobile-phonebook/pulls/4,4,Add Mozilla Code of Conduct,"Fixes #3

_(Message COC002)_",Mozilla-GitHub-Standards,48073334,2019-03-28T03:59:40Z,NONE,False,15,0,1,A mobile version of the LDAP phonebook.,HTML,9394adc6562ac293a622243212ea69ece46a6bf5,"Add Mozilla Code of Conduct file

Fixes #3.

_(Message COC002)_"
1,https://api.github.com/repos/mozilla/mobile-phonebook/pulls/1,1,Remove README rationale for repo being private,"I've read through this code and confirmed the only possible piece of data that's not public is the URL to the LDAP server. I've checked with jabba and confirmed that this URL is not private and it can be made public.

This PR removes the readme text explaining why the repo is private. I'll make the repo public after we merge it.",gene1wood,1134034,2018-10-25T18:47:43Z,MEMBER,True,0,4,1,A mobile version of the LDAP phonebook.,HTML,4b9ff1ec7f71c3c30663dd9ee014d39b49506fcd,Remove README rationale for repo being private
