,pullid,pulls_number,pulltitle,pullsbody,pullsuserlogin,pullsuserid,pullauthordate,author_association,merged_status,stats_addns,stats_delns,stats_changed_files,pull_repo_desc,pull_repo_lang,pull_commit_sha,pull_commit_message
0,https://api.github.com/repos/mozilla/addons-nginx/pulls/18,18,Update default port for addons-frontend backend,Needs https://github.com/mozilla/addons-frontend/pull/9970,willdurand,217628,2021-01-08T11:21:14Z,MEMBER,True,2,1,1,,Dockerfile,9289cf97e7adfffc144d4f3c960e73d5ef6b4700,Update default port for addons-frontend backend
1,https://api.github.com/repos/mozilla/addons-nginx/pulls/17,17,Force stats endpoints to go to olympia,,willdurand,217628,2020-05-27T09:18:12Z,MEMBER,True,4,0,1,,Dockerfile,597c38e584922b7f8fb2a1f898bea6136b48ee95,Force stats endpoints to go to olympia
2,https://api.github.com/repos/mozilla/addons-nginx/pulls/16,16,Configure XSENDFILE for storage/guarded-addons,Please see https://github.com/mozilla/addons-server/issues/13433#issuecomment-587239645,mirefly,4984681,2020-02-19T00:22:24Z,CONTRIBUTOR,True,5,0,1,,Dockerfile,9cc1f85416ad73c88c59ce9d569d4853d6ac5123,Configure XSENDFILE for storage/guarded-addons
3,https://api.github.com/repos/mozilla/addons-nginx/pulls/15,15,Configure XSENDFILE for storage/files,"This patch adds a new `location` that is XSENDFILE compliant, according to our production settings and https://www.nginx.com/resources/wiki/start/topics/examples/xsendfile/.",willdurand,217628,2019-09-10T09:54:11Z,MEMBER,True,7,3,1,,Dockerfile,ef3cfc34be4ebecabce92cc36ca711fc3790b8ba,Configure XSENDFILE for storage/files
4,https://api.github.com/repos/mozilla/addons-nginx/pulls/14,14,Configure uwsgi,"Nginx configuration part for https://github.com/mozilla/addons-server/issues/6668

Unfortunately this breaks `make debug` for now afaik which I think can be tackled in a separate step. Fixing cpu load related issues from #11539 seems more important.",EnTeQuAk,139033,2019-07-18T17:14:59Z,CONTRIBUTOR,True,13,18,1,,Dockerfile,875af244c98dd7f14a312684192a913f60124eb0,Configure uwsgi
5,https://api.github.com/repos/mozilla/addons-nginx/pulls/14,14,Configure uwsgi,"Nginx configuration part for https://github.com/mozilla/addons-server/issues/6668

Unfortunately this breaks `make debug` for now afaik which I think can be tackled in a separate step. Fixing cpu load related issues from #11539 seems more important.",EnTeQuAk,139033,2019-07-18T17:14:59Z,CONTRIBUTOR,True,13,18,1,,Dockerfile,7f2473d66f1a3bc375f66e753f2224142b6d325e,"Add 'Vary' to the response, not the request."
6,https://api.github.com/repos/mozilla/addons-nginx/pulls/14,14,Configure uwsgi,"Nginx configuration part for https://github.com/mozilla/addons-server/issues/6668

Unfortunately this breaks `make debug` for now afaik which I think can be tackled in a separate step. Fixing cpu load related issues from #11539 seems more important.",EnTeQuAk,139033,2019-07-18T17:14:59Z,CONTRIBUTOR,True,13,18,1,,Dockerfile,8089b9139375f982771ec19e1e2a2bccf0b88037,"Disable uwsgi buffering, similarly to what we do on dev/stage/prod"
7,https://api.github.com/repos/mozilla/addons-nginx/pulls/14,14,Configure uwsgi,"Nginx configuration part for https://github.com/mozilla/addons-server/issues/6668

Unfortunately this breaks `make debug` for now afaik which I think can be tackled in a separate step. Fixing cpu load related issues from #11539 seems more important.",EnTeQuAk,139033,2019-07-18T17:14:59Z,CONTRIBUTOR,True,13,18,1,,Dockerfile,e2c5c4011080b5dee14462afbdf40cf131c7088c,Increase connect/read timeouts with values from prod
8,https://api.github.com/repos/mozilla/addons-nginx/pulls/13,13,Changing Nginx to alpine version,It would be useful to use the alpine version of Nginx as it makes the container ultra-light.,kmehant,15800200,2019-06-26T18:15:47Z,NONE,False,1,1,1,,Dockerfile,33f3c45ff05f4663cab49306e3fe654dbfbed543,Changing Nginx to alpine version
9,https://api.github.com/repos/mozilla/addons-nginx/pulls/12,12,All API calls should go to olympia,Follow-up: https://github.com/mozilla/addons-nginx/pull/11#discussion_r281991251,willdurand,217628,2019-05-08T09:42:28Z,MEMBER,True,1,1,1,,Dockerfile,12f37a863cb7ed4772974a3ca178830d0476b9ef,All API calls should go to olympia
10,https://api.github.com/repos/mozilla/addons-nginx/pulls/11,11,Allow /api/v5/,I had trouble setting up a local env with code-manger and addons-server. This is needed to hopefully run code-manager locally with a local olympia instance.,willdurand,217628,2019-05-08T09:38:21Z,MEMBER,True,1,1,1,,Dockerfile,e3b6341c3a56d6a1451f07fefd74e4177a26665d,Allow /api/v5/
11,https://api.github.com/repos/mozilla/addons-nginx/pulls/10,10,Add Mozilla Code of Conduct,"Fixes #9


As of January 1 2019, Mozilla requires that all GitHub projects include this [CODE_OF_CONDUCT.md](https://github.com/mozilla/repo-templates/blob/master/templates/CODE_OF_CONDUCT.md) file in the project root. The file has two parts:

1. Required Text - All text under the headings *Community Participation Guidelines and How to Report*, are required, and should not be altered.
2. Optional Text - The Project Specific Etiquette heading provides a space to speak more specifically about ways people can work effectively and inclusively together. Some examples of those can be found on the [Firefox Debugger](https://github.com/devtools-html/debugger.html/blob/master/CODE_OF_CONDUCT.md) project, and [Common Voice](https://github.com/mozilla/voice-web/blob/master/CODE_OF_CONDUCT.md). (The optional part is commented out in the [raw template file](https://raw.githubusercontent.com/mozilla/repo-templates/blob/master/templates/CODE_OF_CONDUCT.md), and will not be visible until you modify and uncomment that part.)

If you have any questions about this file, or Code of Conduct policies and procedures, please see [Mozilla-GitHub-Standards](https://wiki.mozilla.org/GitHub/Repository_Requirements) or email Mozilla-GitHub-Standards+CoC@mozilla.com.

_(Message COC002)_",Mozilla-GitHub-Standards,48073334,2019-03-29T17:04:27Z,CONTRIBUTOR,True,15,0,1,,Dockerfile,b93ce24f002f7a0ab8fd0cab09520e7c54a3af9e,"Add Mozilla Code of Conduct file

Fixes #9.

_(Message COC002)_"
12,https://api.github.com/repos/mozilla/addons-nginx/pulls/7,7,Default requests to addons-frontend and fall back to addons-server.,"Fixes https://github.com/mozilla/addons-server/issues/9080

Todo:

* [x] At least optimize API access for performance, default `/api/v3|v4/` requests to hit olympia directly",EnTeQuAk,139033,2018-08-29T06:05:05Z,CONTRIBUTOR,True,62,1,1,,Dockerfile,2b08e5a33caec8b8ed02c7cd3885251df733c19d,Default requests to addons-frontend and fall back to addons-server.
13,https://api.github.com/repos/mozilla/addons-nginx/pulls/7,7,Default requests to addons-frontend and fall back to addons-server.,"Fixes https://github.com/mozilla/addons-server/issues/9080

Todo:

* [x] At least optimize API access for performance, default `/api/v3|v4/` requests to hit olympia directly",EnTeQuAk,139033,2018-08-29T06:05:05Z,CONTRIBUTOR,True,62,1,1,,Dockerfile,138813882b3bbb94fc6a3cd07cb08041079d90e7,Default requests through the api to olympia
14,https://api.github.com/repos/mozilla/addons-nginx/pulls/7,7,Default requests to addons-frontend and fall back to addons-server.,"Fixes https://github.com/mozilla/addons-server/issues/9080

Todo:

* [x] At least optimize API access for performance, default `/api/v3|v4/` requests to hit olympia directly",EnTeQuAk,139033,2018-08-29T06:05:05Z,CONTRIBUTOR,True,62,1,1,,Dockerfile,b875f4f1ef5d4c6e25be8533bf7a71284fdf91f1,Merge branch 'master' of github.com:mozilla/addons-nginx into default-addons-frontend
15,https://api.github.com/repos/mozilla/addons-nginx/pulls/7,7,Default requests to addons-frontend and fall back to addons-server.,"Fixes https://github.com/mozilla/addons-server/issues/9080

Todo:

* [x] At least optimize API access for performance, default `/api/v3|v4/` requests to hit olympia directly",EnTeQuAk,139033,2018-08-29T06:05:05Z,CONTRIBUTOR,True,62,1,1,,Dockerfile,b4ec35fd1b1373451a188b12b39bfd9e6d7dcf8f,Fix typo
16,https://api.github.com/repos/mozilla/addons-nginx/pulls/6,6,Support serving /site-static/,Fixes #5,EnTeQuAk,139033,2018-07-09T16:15:31Z,CONTRIBUTOR,True,4,0,1,,Dockerfile,4a7a7a3dee7210ae35ceebf8f1c1955f6e81e3fa,"Support serving /site-static/

Fixes #5"
17,https://api.github.com/repos/mozilla/addons-nginx/pulls/4,4,forward admin,,EnTeQuAk,139033,2017-06-30T16:12:19Z,CONTRIBUTOR,True,4,1,1,,Dockerfile,cd551052e143302bce551bd611119a6948286ff5,Update addons.conf
18,https://api.github.com/repos/mozilla/addons-nginx/pulls/3,3,Pass correct Host header.,"Refs mozilla/addons-server#3347

This should pass on the browsers `Host` header to the proxy. Hoping this fixes various of errors we see and actually works...",EnTeQuAk,139033,2016-11-01T20:00:57Z,CONTRIBUTOR,True,1,0,1,,Dockerfile,54f89db0fec03663a5d8ad8ea7e309e0e970d8e0,"Pass correct Host header.

Refs #mozilla/addons-server#3347"
19,https://api.github.com/repos/mozilla/addons-nginx/pulls/2,2,Fix mox_header css refs,"Has a requirement in olympia too. 
",muffinresearch,1514,2016-01-12T15:25:47Z,MEMBER,True,4,0,1,,Dockerfile,07201ccb735c248c185e4ab31178dfdae1cfc23e,Fix moz_header css refs
20,https://api.github.com/repos/mozilla/addons-nginx/pulls/1,1,Add a dummy CSP endpoint for local dev,"This a nginx endpoint for CSP in dev which will return 204 for reports for local-dev only.
",muffinresearch,1514,2016-01-11T17:01:24Z,MEMBER,True,6,0,1,,Dockerfile,75ca04a80c4fcad8748014d1d6d70844158d9e39,Add a dummy CSP endpoint for local dev
