,pullid,pulls_number,pulltitle,pullsbody,pullsuserlogin,pullsuserid,pullauthordate,author_association,merged_status,stats_addns,stats_delns,stats_changed_files,pull_repo_desc,pull_repo_lang,pull_commit_sha,pull_commit_message
0,https://api.github.com/repos/mozilla/gecko-projects/pulls/12,12,Update README.md,Corrected the spelling of word rarely.,preyunk,12710227,2019-05-24T18:22:45Z,NONE,False,1,1,1,"r/o mirror of hg.mozilla.org/projects/ -- 'master' never updated, check the branch you care about.",,617410d01fbab32dfa803636a26f651e4ce3663b,"Update README.md

Fixed the spelling of the word ""rarely"""
1,https://api.github.com/repos/mozilla/gecko-projects/pulls/12,12,Update README.md,Corrected the spelling of word rarely.,preyunk,12710227,2019-05-24T18:22:45Z,NONE,False,1,1,1,"r/o mirror of hg.mozilla.org/projects/ -- 'master' never updated, check the branch you care about.",,f741c85697892ffc30f3d66c6c26c05147ee9507,"Merge pull request #1 from PreYunk/PreYunk-patch-1

Update README.md"
2,https://api.github.com/repos/mozilla/gecko-projects/pulls/11,11,Add Mozilla Code of Conduct,"
As of January 1 2019, Mozilla requires that all GitHub projects include this [CODE_OF_CONDUCT.md](https://github.com/mozilla/repo-templates/blob/master/templates/CODE_OF_CONDUCT.md) file in the project root. The file has two parts:

1. Required Text - All text under the headings *Community Participation Guidelines and How to Report*, are required, and should not be altered.
2. Optional Text - The Project Specific Etiquette heading provides a space to speak more specifically about ways people can work effectively and inclusively together. Some examples of those can be found on the [Firefox Debugger](https://github.com/devtools-html/debugger.html/blob/master/CODE_OF_CONDUCT.md) project, and [Common Voice](https://github.com/mozilla/voice-web/blob/master/CODE_OF_CONDUCT.md). (The optional part is commented out in the [raw template file](https://raw.githubusercontent.com/mozilla/repo-templates/blob/master/templates/CODE_OF_CONDUCT.md), and will not be visible until you modify and uncomment that part.)

If you have any questions about this file, or Code of Conduct policies and procedures, please see [Mozilla-GitHub-Standards](https://wiki.mozilla.org/GitHub/Repository_Requirements) or email Mozilla-GitHub-Standards+CoC@mozilla.com.

_(Message COC002)_",Mozilla-GitHub-Standards,48073334,2019-03-29T04:53:00Z,NONE,False,15,0,1,"r/o mirror of hg.mozilla.org/projects/ -- 'master' never updated, check the branch you care about.",,75b9a102cae680ee04a331ed119d5a8a15117a8d,"See PR for details

_(Message COC002)_"
3,https://api.github.com/repos/mozilla/gecko-projects/pulls/3,3,fixing a single typo in README.md,fixing a single typo in README.md,ghost,10137,2017-09-12T09:58:27Z,NONE,False,1,1,1,"r/o mirror of hg.mozilla.org/projects/ -- 'master' never updated, check the branch you care about.",,f50f2517da2a76e2ac2811b44e78ec22141b5b53,Update README.md
4,https://api.github.com/repos/mozilla/gecko-projects/pulls/2,2,corrected typo error in README.md,,kskarthik,11899221,2016-04-12T12:06:19Z,NONE,False,1,1,1,"r/o mirror of hg.mozilla.org/projects/ -- 'master' never updated, check the branch you care about.",,3a60e3bc4bb0b092fbb4dd04f19357ed8a29d4cb,corrected typo error in README.md
5,https://api.github.com/repos/mozilla/gecko-projects/pulls/1,1,Set b2g.is_mulet to trigger different path in marionette server.,"https://bugzilla.mozilla.org/show_bug.cgi?id=1164538
",KevinGrandon,122602,2015-05-31T20:54:38Z,NONE,False,1,0,1,"r/o mirror of hg.mozilla.org/projects/ -- 'master' never updated, check the branch you care about.",,3284de9699b1eb315592df33ba2aa47ab21d404f,Set b2g.is_mulet to trigger different path in marionette server.
