,pullid,pulls_number,pulltitle,pullsbody,pullsuserlogin,pullsuserid,pullauthordate,author_association,merged_status,stats_addns,stats_delns,stats_changed_files,pull_repo_desc,pull_repo_lang,pull_commit_sha,pull_commit_message
0,https://api.github.com/repos/mozilla/cheesecake/pulls/3,3,Fix mysql-community-server install (fixes #2),"This sets up the mysql yum repo so the mysql-community-\* packages can be installed.

r? @jasonthomas 

I've add a new module dir for cheesecake because I'm thinking that might be useful for defining the bits specific to utilizing the other puppet modules for this project.

Let me know if you have any thoughts re: better layout etc.

To test this I ran `vagrant destroy && vagrant up` (Be sure there's nothing you want to keep in the existing image before you do that).
",muffinresearch,1514,2014-05-14T12:39:43Z,MEMBER,True,23,1,4,,Puppet,e30eadd4ffa8180ce1168dd95986c7989fa95485,Fix mysql-community-server install (fixes #2)
