,reponame,commitid,commitmsg,commitauthor,commitauthordate,comauthorlogin,shaauthorlogin,stats_total,stats_addns,stats_delns
0,mozillians,9aefbdced16d171f41d1f31f29ce2cb51b21a161,Removed picture.,Fred Wenzel,2011-01-31T21:24:51Z,Fred Wenzel,Fred Wenzel,4,1,3
1,mozillians,cee787d81f3bfc99b260a9f4d922e78e6718cf7f,Made translate-toolkit version in requirements match vendor library. Closes #12.,Fred Wenzel,2011-01-27T17:04:56Z,Fred Wenzel,Fred Wenzel,2,1,1
2,mozillians,0f916323d0cd92180615bd8c87f01de274f72c7a,Since playdoh has different branches on project and vendor repos... we should have two branches per env,Austin King,2011-01-27T05:04:29Z,ozten,ozten,18,12,6
3,mozillians,de1f1e8462c372439221d8ddfadb4d2a5a30a732,Moving wsgi.wsgi into wsig/playdoh.wsgi,Austin King,2011-01-26T21:43:51Z,ozten,ozten,3,2,1
4,mozillians,33fc1c31ca2fb7473ba221bb6c5169380f4dd8c4,"Changed packaging format to something less troublesome, and added docs for it.",Fred Wenzel,2011-01-25T18:41:24Z,Fred Wenzel,Fred Wenzel,118,111,7
5,mozillians,d3dab83593dc33634af0f81949573a3828591cb5,Make tests accessible for nose.,Fred Wenzel,2011-01-25T18:39:34Z,Fred Wenzel,Fred Wenzel,0,0,0
6,mozillians,e772c90001e12d4e80b4b8238ad7927cc03e91cc,Database migration docs.,Fred Wenzel,2011-01-25T00:38:50Z,Fred Wenzel,Fred Wenzel,66,61,5
7,mozillians,96fe1a5adb19f66f24d9efa472cf73d003425552,"Suggest an SVN checkout for L10n, rather than a git clone. Closes #11.",Fred Wenzel,2011-01-24T17:19:55Z,Fred Wenzel,Fred Wenzel,88,50,38
8,mozillians,714567f0e97d10a08fcf31712e96bfd8b3787721,"any, not every",Fred Wenzel,2011-01-22T23:16:09Z,Fred Wenzel,Fred Wenzel,4,2,2
9,mozillians,d28c8818f0b6b413527fbd898c7bd1270538fab7,chmod,Fred Wenzel,2011-01-22T23:12:47Z,Fred Wenzel,Fred Wenzel,0,0,0
10,mozillians,0b039b5634e004c4e6b40b98ee014736c57eab9c,sphinx complained about indentation errors.,Fred Wenzel,2011-01-22T23:12:26Z,Fred Wenzel,Fred Wenzel,22,11,11
11,mozillians,b476dd22e937b732f3d0544d091975c4a0f3d3ce,Use commonware.response.cookies to enable secure and httponly cookies by default. Closes Issue 3.,Fred Wenzel,2011-01-22T23:06:43Z,Fred Wenzel,Fred Wenzel,22,20,2
12,mozillians,84b3cbff37d4ead7d48d651b7bc7d16cff112b60,Adding operations notes and documenting ./bin/update_site.py,Austin King,2011-01-21T17:54:44Z,ozten,ozten,67,65,2
13,mozillians,c8cf073a183142dc88fde18c88fecb4049b75092,Updated jingo.,Fred Wenzel,2011-01-21T17:34:29Z,Fred Wenzel,Fred Wenzel,2,1,1
14,mozillians,b8f356e0d58a85f7e1b509fcb538e3b2bb0430b1,Updated commonware.,Fred Wenzel,2011-01-20T23:00:44Z,Fred Wenzel,Fred Wenzel,2,1,1
15,mozillians,8b5dfa458b0532a334d6985e609444efd39e70bf,docs now live on github.,Fred Wenzel,2011-01-20T21:04:18Z,Fred Wenzel,Fred Wenzel,2,1,1
16,mozillians,38559b2082d58b10ee86570d9a425b65aae1aba1,Added best practices section,Fred Wenzel,2011-01-20T20:52:11Z,Fred Wenzel,Fred Wenzel,61,60,1
17,mozillians,22f18e4da56deb30028b3b2a19eebaf1bbeeea34,"Committing locally is fun and games, but then I have to push manually. Let's automate it all.",Fred Wenzel,2011-01-20T18:06:13Z,Fred Wenzel,Fred Wenzel,2,1,1
18,mozillians,9ed4c3966dd12aa15d9963920791c9c408678e82,Added build-github script from Zamboni to push docs to gh-pages automagically.,Fred Wenzel,2011-01-20T17:50:35Z,Fred Wenzel,Fred Wenzel,40,39,1
19,mozillians,a2764efa6a3ed43706d0698b556d4f86a691c65e,Shamelessly stole^Wborrowed the sphinx page from Zamboni.,Fred Wenzel,2011-01-20T16:49:30Z,Fred Wenzel,Fred Wenzel,74,74,0
20,mozillians,2b1d9f43b00d62376a0699a91029d2a39e2fe265,More extensive documentation on setting up SVN/git-based L10n.,Fred Wenzel,2011-01-20T00:35:34Z,Fred Wenzel,Fred Wenzel,130,102,28
21,mozillians,9dab97cdaa850e315dcce4eba119cc4a0fb0a1ea,Added translate-toolkit.,Fred Wenzel,2011-01-20T00:34:36Z,Fred Wenzel,Fred Wenzel,4,2,2
22,mozillians,af9af41839726da65e71075b9e274b9f966d125d,Added autol10n script.,Fred Wenzel,2011-01-19T23:52:52Z,Fred Wenzel,Fred Wenzel,37,37,0
23,mozillians,0068d78fa6fedeb16fda3284da9dd864e9741d06,TEXT_DOMAIN setting for gettext was missing.,Fred Wenzel,2011-01-19T22:27:21Z,Fred Wenzel,Fred Wenzel,3,3,0
24,mozillians,f2a39e8447463d707e3c2c7132b2e259c8a74d34,Added Babel,Fred Wenzel,2011-01-19T18:01:46Z,Fred Wenzel,Fred Wenzel,5,3,2
25,mozillians,0f6622c374af25c7afa5533decced961d38b76cb,Moving compile-mo into bin and integrating locale/README into docs,Austin King,2011-01-14T23:01:24Z,ozten,ozten,80,75,5
26,mozillians,f17312771ec3f08f00e6b8023d4df5f14f5b32c1,Adding L10n docs,Austin King,2011-01-14T22:38:29Z,ozten,ozten,37,37,0
27,mozillians,c70994cda8a46b20b8585190ae06d98f4a4256db,Whoops locale doesn't belong in Playdoh directly,Austin King,2011-01-14T22:06:14Z,ozten,ozten,38,0,38
28,mozillians,38ac1352fc2a47a7faf0ef395292b9bf9449d38f,Adding L10n transltetoolkit,Austin King,2011-01-14T19:12:09Z,ozten,ozten,3,3,0
29,mozillians,35314e1ba7e05b78bae703b7c8323485739b3d4a,Creating skelton locale dir,Austin King,2011-01-14T01:27:02Z,ozten,ozten,38,38,0
30,mozillians,10473df57ef78c8f7943c0854117bd5268170e1c,Text formatting cosmetics.,Fred Wenzel,2011-01-13T02:40:14Z,Fred Wenzel,Fred Wenzel,32,19,13
31,mozillians,8251d497602afa87c9387c337bd236d0a3085030,Making git ignore emacs temp files,Austin King,2011-01-13T00:58:51Z,ozten,ozten,1,1,0
32,mozillians,e9ddbc85e15e912d3158211b3a7c9649c2e7d131,Not everyone is running pythonz these dayz...,Austin King,2011-01-12T21:00:42Z,ozten,ozten,2,1,1
33,mozillians,5eecf599d399df5583523c9a8c4c32f13c73161c,"Basic site update script for dev, stage, or production environments.",Austin King,2011-01-12T01:20:01Z,ozten,ozten,93,93,0
34,mozillians,22de7b7ae0a1adb8a042ff1fe0c1b34b6f736323,No need to exclude any migrations from our tests.,Fred Wenzel,2011-01-07T02:06:15Z,Fred Wenzel,Fred Wenzel,3,1,2
35,mozillians,ce47f278c605f198740b7a5bfb57651f259c7130,uhm.,Fred Wenzel,2011-01-07T02:01:58Z,Fred Wenzel,Fred Wenzel,2,1,1
36,mozillians,ae53150f1a9d1ff230cf34e82ac456989235b0fa,"Generic migration tests, borrowed from kitsune.",Erik Rose,2011-01-07T02:00:27Z,erikrose,erikrose,51,51,0
37,mozillians,e7818348153e2329a66d2cae12f41f4acdd12eb1,"Added nose, django-nose, and test-utils.",Fred Wenzel,2011-01-07T01:52:30Z,Fred Wenzel,Fred Wenzel,43,31,12
38,mozillians,e7e77ff898770bace32f1e2ac065f69652513f10,Fixed L10n and docs URL for example view.,Fred Wenzel,2011-01-07T00:09:58Z,Fred Wenzel,Fred Wenzel,12,6,6
39,mozillians,5527311ed36d1f51c610f3ea53ffc1fc3fc1bea2,Added schematic.,Fred Wenzel,2011-01-07T00:06:31Z,Fred Wenzel,Fred Wenzel,40,38,2
40,mozillians,eafc1bef564051e09420c28c21ca05194ad3b073,"Play-Doh it's fun to play with, but not to eat",Austin King,2011-01-06T23:10:23Z,ozten,ozten,41,38,3
41,mozillians,4be0ae8545ea25460403fce759597bbecf1458f8,Added known locales list. Added LANG and DIR to the context.,Fred Wenzel,2011-01-06T00:10:47Z,Fred Wenzel,Fred Wenzel,42,32,10
42,mozillians,c28669367e27297417490853e352459b4d05a620,Added jingo-minify and asset minification samples. Added jQuery 1.4.4.,Fred Wenzel,2011-01-06T00:02:08Z,Fred Wenzel,Fred Wenzel,241,237,4
43,mozillians,de8490068a2f6c1093f0b852e8a6e588e65a84bd,Updates to library list,Fred Wenzel,2011-01-05T23:26:36Z,Fred Wenzel,Fred Wenzel,8,6,2
44,mozillians,85692f5c9d89a94588eb11905e5c23d86a0efefc,Added tower L10n library.,Fred Wenzel,2011-01-05T23:21:24Z,Fred Wenzel,Fred Wenzel,44,36,8
45,mozillians,9d8e6efa54bfe5d17ec8f6e82bb4a084dc2a1903,Added jingo and an example app rendering a simple template.,Fred Wenzel,2011-01-05T23:06:53Z,Fred Wenzel,Fred Wenzel,62,58,4
46,mozillians,e9bcb86494f211020d492dc648dc4524178772d9,Shorter URL for docs.,Fred Wenzel,2011-01-05T22:38:22Z,Fred Wenzel,Fred Wenzel,2,1,1
47,mozillians,7405c171e6ffb1c22141fab0081b7a9f618b0302,virtual*env*,Fred Wenzel,2011-01-05T17:50:17Z,Fred Wenzel,Fred Wenzel,2,1,1
48,mozillians,de0e1dafa59b5fcaebeae58f868ab77b5bc9501d,Added a list of libraries. Probably not even remotely comprehensive.,Fred Wenzel,2011-01-05T17:24:28Z,Fred Wenzel,Fred Wenzel,90,90,0
49,mozillians,81775bc1a3dece3b8dbc421ff5bc17c8e185b430,Docs auto-built on readthedocs.,Fred Wenzel,2011-01-05T00:25:53Z,Fred Wenzel,Fred Wenzel,2,1,1
50,mozillians,b3c6005fa063793c60326bfe2e3b2cbf2c5f6af4,Added LICENSE document.,Fred Wenzel,2011-01-05T00:07:09Z,Fred Wenzel,Fred Wenzel,25,25,0
51,mozillians,8f658fef36913222d314af3a5f2cf014c130b8bc,Moved some documentation from README to sphinx. Closes #6.,Fred Wenzel,2011-01-05T00:06:57Z,Fred Wenzel,Fred Wenzel,125,70,55
52,mozillians,f5dc948737d9ec714b343125664c994e604d17ec,Added Sphinx (the documentation tool),Fred Wenzel,2011-01-04T23:12:34Z,Fred Wenzel,Fred Wenzel,373,373,0
53,mozillians,6b0e693383d2aa386abcafd23ec892c659d5cfa8,Adding our basic L10n libraries,Austin King,2011-01-04T23:14:08Z,ozten,ozten,6,6,0
54,mozillians,678e6b0fc4ccb5b71437fef22c6418ba29c2edcb,"Added commonware, used X-Frame-Options middleware.",Fred Wenzel,2011-01-04T02:20:27Z,Fred Wenzel,Fred Wenzel,17,16,1
55,mozillians,a8e7be51ab0fe64a7bee15b93ec80ec1a808fc1a,Use SHA-512 by default.,Fred Wenzel,2011-01-04T02:03:01Z,Fred Wenzel,Fred Wenzel,8,4,4
56,mozillians,f1445eaa32093467b385206a7918a34911b92756,"Recursive clone to check out initially. To start project, fork and branch to master.",Fred Wenzel,2011-01-03T23:54:18Z,Fred Wenzel,Fred Wenzel,23,19,4
57,mozillians,3d414adc7856a30208a3e71a310e0213cc2dfd72,Updated django-sha256.,Fred Wenzel,2010-12-30T00:17:15Z,Fred Wenzel,Fred Wenzel,1,1,0
58,mozillians,d5535e8e25794bd18b7560c2371730b09c2f2327,Updated django-sha256.,Fred Wenzel,2010-12-30T00:16:54Z,Fred Wenzel,Fred Wenzel,2,1,1
59,mozillians,d507d0d2cad12f7d01c9c8c6cc22dac3962db6f2,Added empty media directories.,Fred Wenzel,2010-12-30T00:07:21Z,Fred Wenzel,Fred Wenzel,0,0,0
60,mozillians,5db7edbabc276802786dd88e93bc1fb3c513b4a8,Added django-sha256,Fred Wenzel,2010-12-30T00:07:10Z,Fred Wenzel,Fred Wenzel,14,13,1
61,mozillians,d118a3bbdcb52683c8f191acdc79a5d0a94d0211,No user image uploads by default.,Fred Wenzel,2010-12-29T23:40:05Z,Fred Wenzel,Fred Wenzel,1,0,1
62,mozillians,5610113748f9121c80da6015d2a9ac44bf7eac78,Check out vendor library recursively when starting.,Fred Wenzel,2010-12-29T23:39:49Z,Fred Wenzel,Fred Wenzel,5,4,1
63,mozillians,b7982f90e949b7c2d29410bd74c027287f393743,Renamed settings_local dist file,Fred Wenzel,2010-12-29T23:39:22Z,Fred Wenzel,Fred Wenzel,0,0,0
64,mozillians,a8db7cfe9fd300b800bf58c70a4b6b930cd7cdfe,Added empty apps dir.,Fred Wenzel,2010-12-29T00:02:15Z,Fred Wenzel,Fred Wenzel,0,0,0
65,mozillians,0ea9f05a3025bcd70f6087a8cd0ed065896ec884,"Moving around the settings file, creating a settings_local template.",Fred Wenzel,2010-12-29T00:01:29Z,Fred Wenzel,Fred Wenzel,96,66,30
66,mozillians,3c81e3d271afd6bba47e9b8e693ccf0859958100,Packaging in Zamboni.,Fred Wenzel,2010-12-28T23:45:06Z,Fred Wenzel,Fred Wenzel,3,3,0
67,mozillians,5bf5bc1c531e1c959e1396114086a9758b3a6c32,Added compiled and dev requirements files,Fred Wenzel,2010-12-28T23:42:42Z,Fred Wenzel,Fred Wenzel,7,7,0
68,mozillians,c897a5c61b1bb7b5bb6988692a5c430ed76d001d,added a readme.,Fred Wenzel,2010-12-28T23:40:48Z,Fred Wenzel,Fred Wenzel,36,36,0
69,mozillians,88cbf138695856773897cac09facd1a45a6c1e8d,Switch from bam-lib to playdoh-lib,Fred Wenzel,2010-12-28T23:25:45Z,Fred Wenzel,Fred Wenzel,2,1,1
70,mozillians,effd10c952d25e41560a93f3ecf39f8fcd408bb2,@require_post requires post,Jeff Balogh,2010-12-16T22:05:46Z,Jeff Balogh,Jeff Balogh,10,10,0
71,mozillians,fd0bca7997ed6bb7081930febdc627c92d70b5b1,adding a requirements file,Jeff Balogh,2010-12-16T22:05:21Z,Jeff Balogh,Jeff Balogh,3,3,0
72,mozillians,292f85df586576028195ad34f9f29417221422b9,get a .wsgi loader,Jeff Balogh,2010-12-16T22:05:04Z,Jeff Balogh,Jeff Balogh,16,16,0
73,mozillians,6d94ac6593297c224afa289a8dc8105608ee7030,updating vendor,Jeff Balogh,2010-12-16T22:03:19Z,Jeff Balogh,Jeff Balogh,2,1,1
74,mozillians,6736c9534e402cbe72c79979e1ae006d24ea91eb,adding .gitignore,Jeff Balogh,2010-12-16T22:02:26Z,Jeff Balogh,Jeff Balogh,16,16,0
75,mozillians,477c59d005ffe64c43e83fe409145295e6074e31,adding celery,Jeff Balogh,2010-12-16T22:01:40Z,Jeff Balogh,Jeff Balogh,14,14,0
76,mozillians,5d3b97a035994b824d56d22bec1065105f46b76f,contenttypes is needed for syncdb,Jeff Balogh,2010-12-16T22:01:10Z,Jeff Balogh,Jeff Balogh,2,1,1
77,mozillians,a1930af50d098f4c81fce5e810d436e8dab49488,try to find settings_local instead of settings.py,Jeff Balogh,2010-12-16T22:00:29Z,Jeff Balogh,Jeff Balogh,17,12,5
78,mozillians,80fdffd4244f4206068f3ce3c6a36a6880251a76,add a vendor lib,Jeff Balogh,2010-12-15T23:43:43Z,Jeff Balogh,Jeff Balogh,28,28,0
79,mozillians,d3d53069b64972531e0cb73fe70cf44bf2d078ce,only keep contrib.auth,Jeff Balogh,2010-12-15T23:32:18Z,Jeff Balogh,Jeff Balogh,10,4,6
80,mozillians,80ee5a944902cf45ee9f39eb80b6bbbeafda9e1e,BUST A MOVE,Jeff Balogh,2010-12-15T23:31:13Z,Jeff Balogh,Jeff Balogh,123,123,0
81,mozillians,549eb7b819ab89b5fe9fe1e6886b4c2a64f1087e,I've gotten faster performance by using NFS,Dave Dash,2011-07-12T00:06:23Z,davedash,davedash,4,2,2
82,mozillians,6766d23ceae431bfef58a4e2b9775985a8d79167,Commenting out Auth work in progress. Wiring up search a little. (search by email based on sample data),Austin King,2011-07-02T00:44:01Z,ozten,ozten,60,46,14
83,mozillians,afb1dc0d1f1039b9505d67404a9cd37d370baa47,Making dist files have correct ldap master user,Austin King,2011-07-02T00:00:31Z,ozten,ozten,19,12,7
84,mozillians,d20b7ab08c58287eeebdb5b8f1ef5f0e124a2476,Adding a few more hints,Austin King,2011-07-01T23:00:12Z,ozten,ozten,12,10,2
85,mozillians,b894f7b0e4622070c07ad8706be6b5b5614e4b30,Snapshotting WIP before vagrant work,Austin King,2011-07-01T21:18:42Z,ozten,ozten,1186,772,414
86,mozillians,6ce6efdf0a5def77522d81bb88fba2ee51314c23,Dropping OS install instructions,Austin King,2011-07-01T21:01:58Z,ozten,ozten,38,0,38
87,mozillians,71f8db1481f038311a95aa68b8ed45712bc9542c,Switching project to Vagrant.,Austin King,2011-07-01T20:52:12Z,ozten,ozten,109,31,78
88,mozillians,e008b0b3f4ab58823595e982cca28e29c70627bc,Tweaks for Ubuntu vbox,Austin King,2011-07-01T20:51:51Z,ozten,ozten,138,99,39
89,mozillians,b56c505add234b47c6e9e9b2cef5d1143007d502,Merge branch 'base' of github.com:mozilla/mozillians into base,Austin King,2011-07-01T18:25:54Z,ozten,ozten,25,24,1
90,mozillians,1332556d3d90b67e6ac533305fcd2e8eae30f0b6,Moving BDB files under /home/vagrant,Austin King,2011-06-30T21:48:03Z,ozten,ozten,27,14,13
91,mozillians,5c7877dafb0f22745bb49d504ef745919c1420c3,"Doc update: search advice and attribute usage

Udated design doc to explain why identical data appears in several attributes
Updated developer advice to make distinction between Applicants and
Mozillians when searching.",Andrew Findlay,2011-06-30T18:58:47Z,afindlay,afindlay,25,24,1
92,mozillians,21b8188e3fde28a9afd17d654cf61cc510d3696e,Removing notes. Most of the way there...,Austin King,2011-06-30T08:11:07Z,ozten,ozten,65,0,65
93,mozillians,ddac48fdabcb5f5caacc3f0ee093755b23442a98,"Rebuilt Centos 5.6 to have Berkeley DB, OpenSSL, Cyrus SASL, and OpenLDAP.",Austin King,2011-06-30T08:08:12Z,ozten,ozten,258,255,3
94,mozillians,4c36da31a647327a5a306a22f557545805b32ee7,Merge remote branch 'afindlay/base' into base,Austin King,2011-06-30T03:58:25Z,ozten,ozten,492,492,0
95,mozillians,5b53e377e51ed1f36cf45569ce07cb09886a67d9,Sigh... missed edit on last commit,Austin King,2011-06-30T03:56:32Z,ozten,ozten,2,1,1
96,mozillians,819d1783a5d2326a58890e9326cd4408a14a8b26,Minimal tweaks to make Vagrant/Puppet complete for Playdoh.,Austin King,2011-06-30T03:49:14Z,ozten,ozten,53,45,8
97,mozillians,bdeff3658457a29987a6c4056085a3d8afef5aa7,First stab as a working Vagrant / Puppet setup,Leslie Michael Orchard,2011-06-29T20:39:10Z,lmorchard,lmorchard,264,264,0
98,mozillians,15cf60368b35002496ffbbd83a9348f6afead646,Renaming domesdayPerson to mozilliansPerson to match LDAP work,Austin King,2011-06-27T23:59:15Z,ozten,ozten,2,1,1
99,mozillians,9ba9c4f83bace57aeffe9bc3e7b120a95cdc9f05,Added developer notes for LDAP,Andrew Findlay,2011-06-27T15:29:05Z,afindlay,afindlay,492,492,0
100,mozillians,99be01519196beafce1e9aeee382dd2ac59d4a14,Bad requirements spec. Fixed.,Austin King,2011-06-27T15:04:42Z,ozten,ozten,2,1,1
101,mozillians,e0df6e765256c2f264fa4857738c9d0645c02589,Adding python-ldap which requires compilation,Austin King,2011-06-26T18:44:06Z,ozten,ozten,3,3,0
102,mozillians,d3a3196cefc16051be8d80ae43829eaa83534af1,Linking to new mozillians-lib version of vendor,Austin King,2011-06-26T18:41:50Z,ozten,ozten,4,4,0
103,mozillians,954c2da0d4b01276249e5bca919fe336f349848e,Un-linking playdoh-lib,Austin King,2011-06-26T18:29:37Z,ozten,ozten,4,0,4
104,mozillians,098682cb705034dce867c74188c2cdfffbd20bb5,"Merge pull request #2 from afindlay/base

Removed obsolete files, added notes",Austin King,2011-06-26T16:07:44Z,ozten,ozten,97,16,81
105,mozillians,0afd1e8356cdb86eea8b6b2e66cf03d664449b31,"Removed obsolete files, added notes

Removed the domesday versions of some files
Added notes on starting the test environment",Andrew Findlay,2011-06-26T12:13:57Z,afindlay,afindlay,97,16,81
106,mozillians,056e34444be6f12395e50406d1d334212a3fddde,Merge remote-tracking branch 'afindlay/base' into base,Austin King,2011-06-26T03:18:21Z,ozten,ozten,10358,10288,70
107,mozillians,d862a4f07ccd8a5a8f9be13f3619128c22974359,"Fixing thread_support issue, using python threading instead of django",Austin King,2011-06-26T01:15:36Z,ozten,ozten,9,5,4
108,mozillians,35dac3848403aaea9d06110c6bfafc1e7cb35e90,No need for sudo here.,Austin King,2011-06-25T06:04:41Z,ozten,ozten,2,1,1
109,mozillians,c2f076a2cddf55ce16b48c98723c9bc68db66483,"Design document added

Brought the LDAP design doc in from http://etherpad.mozilla.com:9000/mozillians-ldap",Andrew Findlay,2011-06-24T19:41:18Z,afindlay,afindlay,374,374,0
110,mozillians,b7601a7d5c51bcff7c4a30661b5205e0d7af6320,"Enforce password hashing

Added a password policy and overlay to prevent clear-text passwords
from being stored in the database.
Any clear-text passwords sent to the server will be hashed using SSHA.
Pre-hashed passwords will be stored as sent.",Andrew Findlay,2011-06-24T16:25:34Z,afindlay,afindlay,28,28,0
111,mozillians,0a79fc146caf20d115f9667c23f31e045c60be0c,"ACLs and tests complete

ACLs now implement the access-control policy as it currently stands (24 June 2011)
Test suite has 85 tests which provide reasonable coverage of the policy
All tests pass",Andrew Findlay,2011-06-24T16:01:31Z,afindlay,afindlay,267,264,3
112,mozillians,9d04ff8c7c157c0a238c687ea8626d52b87cecb3,"LDAP Admin ACLs and tests done

Implemented LDAP Admin
Added tests for it

Changed database params to be faster for testing",Andrew Findlay,2011-06-24T14:43:04Z,afindlay,afindlay,580,538,42
113,mozillians,2213317f5e820e045856d6dd526c0c6d2f6c0c8e,"Renamed example setup file

Example file is now setup.sh-dist
Working file should be setup.sh",Andrew Findlay,2011-06-23T18:56:59Z,afindlay,afindlay,7,6,1
114,mozillians,55f425c0c1906e2a66148c45ea5da436c84a0f96,"More tests, more config

Started to add tests for admin accounts
ACLs now in sync with tests: all pass
Implemented search size limits",Andrew Findlay,2011-06-23T18:50:14Z,afindlay,afindlay,1975,1803,172
115,mozillians,2e0bf0ae0ef7e8078965fa598460533752efcd58,Implemented most ACLs and tests for Mozillians and Applicants,Andrew Findlay,2011-06-23T12:56:13Z,afindlay,afindlay,255,233,22
116,mozillians,d35513eddc015c9e6a077dd79e3f3203bd6506e6,"Added some non-ASCII characters in a user entry

Sample entry 6 now contains a description in several languages
Note that the uid (username) attribute is not 7-bit-ASCII
Make sure that the user 'Åke' can log in please!",Andrew Findlay,2011-06-22T20:06:21Z,afindlay,afindlay,20,17,3
117,mozillians,b9ca623c3c849fa092baef797fc0b8b2439493f2,"More tests implemented.
Started on ACLs",Andrew Findlay,2011-06-22T18:54:50Z,afindlay,afindlay,237,215,22
118,mozillians,11e4e40ef8cef37b0d1c93682e128552a241048c,More tests. They now have cross-ref codes.,Andrew Findlay,2011-06-22T15:06:07Z,afindlay,afindlay,59,52,7
119,mozillians,2cde0a05ec881aa6c6251429d0e4f399e13c1412,Refactored test code,Andrew Findlay,2011-06-22T14:27:58Z,afindlay,afindlay,219,195,24
120,mozillians,56197f7dd9e0623c48a881d7c895b3458277e844,Started work on test suite for ACLs,Andrew Findlay,2011-06-21T18:29:59Z,afindlay,afindlay,129,129,0
121,mozillians,0427382391b70e83fc58263ce061c5456e004f06,Basic test data now loads into LDAP,Andrew Findlay,2011-06-21T14:19:39Z,afindlay,afindlay,1465,1395,70
122,mozillians,1605424f9c7092b7d3a732eb6adbee53987e4750,"Added data generator
Added start of Mozillians schema",Andrew Findlay,2011-06-21T08:23:38Z,afindlay,afindlay,4619,4619,0
123,mozillians,8975c6a371f6ba22b3c08d0b9180060f2c866ed6,Created local test setup so devs can run LDAP server easily,Andrew Findlay,2011-06-20T19:40:37Z,afindlay,afindlay,716,716,0
124,mozillians,4b1b6df838495bb1b782c8a635e1e39dd2aabd20,Adding some notes. Feel free to nuke down the road,Austin King,2011-06-14T22:29:20Z,ozten,ozten,27,27,0
125,mozillians,a347ea167cc3e3d2d75d0adb5bfdea8904dfa511,Moving Ubuntu specific INSTALL sets out into it's own file.,Austin King,2011-06-14T22:24:16Z,ozten,ozten,146,88,58
126,mozillians,293da051b8273da591081912c361c73dff4c4b04,Add django-auth-ldap.,Gervase Markham,2011-06-02T10:37:26Z,Gervase Markham,Gervase Markham,2392,2392,0
127,mozillians,ff668905fa0ecb24e374bc5995162d4e1bcf4705,Move photo to left; other individual card UI improvements.,Gervase Markham,2011-05-25T13:22:43Z,Gervase Markham,Gervase Markham,23,14,9
128,mozillians,a9a7e2d5c54327e453a2d0f9cf6051efafc40b4a,HTML5 field types and form validation.,Gervase Markham,2011-05-25T13:10:06Z,Gervase Markham,Gervase Markham,6,3,3
129,mozillians,40b74b77f30a7dc242f37fa44137e30d664ae6cb,Remove privacy adjustment controls (for now).,Gervase Markham,2011-05-24T14:44:17Z,Gervase Markham,Gervase Markham,293,2,291
130,mozillians,3706b0ce2ac73db8eed97421737b89933ac184f6,"Convert from ""blog"" and ""website"" to single URL field.",Gervase Markham,2011-05-23T15:28:58Z,Gervase Markham,Gervase Markham,98,24,74
131,mozillians,34d7530e7430e781bda768198f7e3180ad0a34ed,Max tag length of 20 characters.,Gervase Markham,2011-05-23T15:12:35Z,Gervase Markham,Gervase Markham,14,9,5
132,mozillians,f26bb580a825820f6dd19e99113238e2862cb42c,Merge branch 'base' of github.com:mozilla/domesday into base,Gervase Markham,2011-05-23T14:54:48Z,Gervase Markham,Gervase Markham,75,55,20
133,mozillians,de1e6b99019979b3a9dda77c9e790cb6a99930b3,Tag landing pages.,Gervase Markham,2011-05-23T14:54:10Z,Gervase Markham,Gervase Markham,189,149,40
134,mozillians,52599be0b72647d702d9c557e0e1f958df1dc17a,More license headers.,Gervase Markham,2011-05-23T14:21:43Z,Gervase Markham,Gervase Markham,226,226,0
135,mozillians,be8849e95a1d30b2ad1749cfd108e7e1cae1a081,Add license blocks.,Gervase Markham,2011-05-23T13:54:30Z,Gervase Markham,Gervase Markham,1508,1472,36
136,mozillians,c5ca1f248b9ccb0085573374fcaf75bd80ee8152,Add clarificatory note.,Gervase Markham,2011-05-23T13:43:09Z,Gervase Markham,Gervase Markham,3,3,0
137,mozillians,374db32e7fdac2bb6efd5e982808eb1d8b502126,Add instructions on converting schema for addition.,Gervase Markham,2011-05-23T13:42:18Z,Gervase Markham,Gervase Markham,29,29,0
138,mozillians,207e805a24ac678c097e0bf5a2dafae83b20e1cf,Further improvements to install instructions and test data.,Gervase Markham,2011-05-13T15:27:14Z,Gervase Markham,Gervase Markham,75,55,20
139,mozillians,2bf1056eee8e53215d2615755e115765c6025d9e,"Use converted LDIF schema, not original format.",Gervase Markham,2011-05-13T14:38:13Z,gerv,gerv,67,41,26
140,mozillians,1fdaa85e62fff2717cac463ea82108bcc6c06f21,Add sample image data and update paths.,Gervase Markham,2011-05-13T13:44:12Z,gerv,gerv,19,10,9
141,mozillians,df1f6c3d5373e45422c22d7a88006c2f7f72cf16,Merge branch 'base' of github.com:mozilla/domesday into base,Gervase Markham,2011-05-13T13:32:36Z,gerv,gerv,1,1,0
142,mozillians,b1efa90779166652a5645ea99c095efad81bd3c7,"Tag writing support, half way to Account writing support (django-ldapdb error), Photo upload support.",Gervase Markham,2011-05-13T13:31:59Z,gerv,gerv,67,55,12
143,mozillians,fe88d871e8e080fe748e2e1127b5aac9d506582b,Putting django-ldapdb onto the python path,Austin King,2011-05-13T04:43:49Z,ozten,ozten,1,1,0
144,mozillians,2d93b50f527a43df28f8f133991ff14a3e2728b9,New list of countries with values that are 2-letter codes.,Gervase Markham,2011-05-11T12:48:54Z,gerv,gerv,530,283,247
145,mozillians,d768d2e249d5e5df21df472a198c695a45dabc98,Support for displaying external account information.,Gervase Markham,2011-05-09T15:42:50Z,gerv,gerv,283,158,125
146,mozillians,c1c59c27752f1f52fd2cd200433cb41cd043eb4a,Initial support for accounts - model and searching,Gervase Markham,2011-05-06T14:40:40Z,gerv,gerv,139,118,21
147,mozillians,c1781e23514bca163ee766429d8698d537466b3b,More services support,Gervase Markham,2011-05-04T16:30:31Z,gerv,gerv,33,18,15
148,mozillians,407a8baeabe6f9b4e163e8982f629a505c53ad09,Add instructions necessary to support use of SQLite for some config data,Gervase Markham,2011-05-04T15:59:57Z,gerv,gerv,11,9,2
149,mozillians,81e391ee687b1d83d606b51c6d67f3fff920e671,Add newer version of django-ldapdb with my upstreamed syncdb fix.,Gervase Markham,2011-05-04T15:19:45Z,gerv,gerv,150,109,41
150,mozillians,594f8ec6625dbe78df3d659c8a3c5ae7fd0ec345,Merge branch 'base' of github.com:mozilla/domesday into base,Gervase Markham,2011-05-04T15:15:03Z,gerv,gerv,29,15,14
151,mozillians,4c3cdef34d4535a42e85fc217d1a615f2b1a6ef1,Add initial support for list of services,Gervase Markham,2011-05-04T15:14:26Z,gerv,gerv,36,32,4
152,mozillians,3775ccbb6fd32d547f0585db39e02677ae6617f6,Switch to proper multi-DB system for LDAP and database,Gervase Markham,2011-05-04T15:13:48Z,gerv,gerv,13,8,5
153,mozillians,2b180cb601259ec54ae1d18af02653e989524e76,Enable admin,Gervase Markham,2011-05-04T15:11:57Z,gerv,gerv,22,15,7
154,mozillians,20b37442a1de6965dcefd12f81f32792a7736b14,Adding libldap2-dev and libssl-dev so pip install works on python-ldap,Austin King,2011-05-03T19:16:55Z,ozten,ozten,2,1,1
