,reponame,commitid,commitmsg,commitauthor,commitauthordate,comauthorlogin,shaauthorlogin,stats_total,stats_addns,stats_delns
0,arch-website,9ff0b4ad94b8f66f7b3be3646977ee9034abd97c,change some scaling,Josh Marinacci,2018-05-09T21:15:15Z,joshmarinacci,joshmarinacci,4,2,2
1,arch-website,518344669176227a7a7852c0d3b115394d4aa30f,"catch fetch errors
remove archway from the about screen",Josh Marinacci,2018-05-09T21:08:11Z,joshmarinacci,joshmarinacci,16,12,4
2,arch-website,065c4b2187a7c781d26f0701e526dcb0f910bbde,"make archwaypanel load existing rendered modules
use the archway in the Preview page
use the archway in the QueueScreen",Josh Marinacci,2018-05-09T20:47:15Z,joshmarinacci,joshmarinacci,40,27,13
3,arch-website,f7374fffe29617413169302675968639bbb152a1,make the queue use the archwaypanel,Josh Marinacci,2018-05-09T17:24:20Z,joshmarinacci,joshmarinacci,18,14,4
4,arch-website,3f71c63ed977b5f22420128646646d23e747528a,cycle the frames every 200 msec,Josh Marinacci,2018-05-09T17:12:02Z,joshmarinacci,joshmarinacci,15,14,1
5,arch-website,18582b6dcee08a1eed9af86d7da89823139639ce,Merge remote-tracking branch 'origin/master',Josh Marinacci,2018-05-09T17:04:24Z,joshmarinacci,joshmarinacci,25586,25586,0
6,arch-website,d1528b7428c0b0257c9cbfaf4c3026c155cd7c68,"Merge pull request #1 from TrevorFSmith/webgl-arch

Start rendering the archway in WebGL",Josh Marinacci,2018-05-09T17:04:11Z,joshmarinacci,joshmarinacci,25586,25586,0
7,arch-website,f96a6139ea3fcc28cdcbb9adfad14036cc27481c,Start rendering the archway in WebGL,Trevor F. Smith,2018-05-08T23:01:51Z,TrevorFSmith,TrevorFSmith,25586,25586,0
8,arch-website,72f4bc30e9f5d65c289ceeaeb5a3785bad6db046,authenticate the publish and queueupdate routes,Josh Marinacci,2018-05-08T19:18:23Z,joshmarinacci,joshmarinacci,19,12,7
9,arch-website,8f8ec98168590bc538ac813108fc5829685c1e29,"move urls to constants file
make queue editor cleanup event listeners when unmounted",Josh Marinacci,2018-05-08T19:02:30Z,joshmarinacci,joshmarinacci,29,19,10
10,arch-website,cca21a2e5c0e4daad1451cc5671202bb06673c32,fix the broken Queue Screen,Josh Marinacci,2018-05-08T18:56:50Z,joshmarinacci,joshmarinacci,2,1,1
11,arch-website,60a87fccb6cb758d2f06e532649d027cbfff4a75,add delete button to delete modules from the queue,Josh Marinacci,2018-05-08T18:55:18Z,joshmarinacci,joshmarinacci,29,21,8
12,arch-website,0148f5080121ed1eff825399d598c045ba42bcb5,"delete all the old dead code from the previous animation editor
make queue editor load the queue and the list of modules, also add items to the queue and save",Josh Marinacci,2018-05-08T18:22:11Z,joshmarinacci,joshmarinacci,269,51,218
13,arch-website,a0da51efdd34c0fb41cc647eb2d633748bfa1ae2,start building the queue editor,Josh Marinacci,2018-05-08T17:31:43Z,joshmarinacci,joshmarinacci,58,57,1
14,arch-website,8e99257feb01fabdb3646b7288ea7b8a51383621,"make the corner button show if you are connected already and log out
cleanup auth code a bit",Josh Marinacci,2018-05-08T17:10:20Z,joshmarinacci,joshmarinacci,48,28,20
15,arch-website,63ed81e8a9a4ae74ff3ddb501bae63eb02488473,make submit module request actually work,Josh Marinacci,2018-05-07T19:26:26Z,joshmarinacci,joshmarinacci,57,36,21
16,arch-website,d80e468cf6c2ffb6a231fa78bf1aee373d522e9a,"make the form fields on the submit page work
make a tag editor
improve the spec",Josh Marinacci,2018-05-07T18:16:09Z,joshmarinacci,joshmarinacci,97,80,17
17,arch-website,4a3edc3f3dbc1c280a937768ce0c106cee15d970,"create a fake editor to test with
implement the workflow to get the module, generate the JSON frames, preview it, collect metadata, then publish it
rewrite part of the auth workflow",josh,2018-05-04T20:49:48Z,joshmarinacci,joshmarinacci,349,262,87
18,arch-website,4b853c66c6ad55d85e895dfaf2732454140db06d,add links to submit screens,josh,2018-05-04T17:27:32Z,joshmarinacci,joshmarinacci,41,39,2
19,arch-website,dbaf5d607476275e7e4b148d74563f0c29ea8e71,"Merge remote-tracking branch 'origin/master'

# Conflicts:
#	src/App.css
#	src/App.js
#	src/QueueScreen.js",josh,2018-05-04T16:22:36Z,joshmarinacci,joshmarinacci,2841,279,2562
20,arch-website,5e4572900c09d1e30d3851698792341a6316d458,initial support for authentication via github,Josh Marinacci,2018-05-02T20:54:02Z,joshmarinacci,joshmarinacci,79,75,4
21,arch-website,15acc80cb77db7889df102185530b067d22bd8c6,switch to https://vr.josh.earth/jsconfeu-builder/api,Josh Marinacci,2018-05-01T18:35:19Z,joshmarinacci,joshmarinacci,2,1,1
22,arch-website,dd834b5233f3b4a99c9d80773fd795fafcaa8ecc,switch to vr.josh.earth for the server,Josh Marinacci,2018-05-01T18:28:49Z,joshmarinacci,joshmarinacci,2,1,1
23,arch-website,f35265c0831310d609a18760bb9634df6f45a060,switch to https for the iframe,Josh Marinacci,2018-05-01T18:26:36Z,joshmarinacci,joshmarinacci,2,1,1
24,arch-website,d7578ca9c6666de13c8388c3ea23426310fa8675,"make the module store fetch the Queue on load
make the QueueScreen render each item in the queue w/ real descriptions and the first frame of animation",Josh Marinacci,2018-05-01T18:06:02Z,joshmarinacci,joshmarinacci,96,79,17
25,arch-website,db6d52ddd44c430573ba0449aecf1f1c96629dc8,more code updates,Josh Marinacci,2018-05-01T17:17:42Z,joshmarinacci,joshmarinacci,70,37,33
26,arch-website,ecf49580942a88cbae7efc8e985fcfde8bdd931f,"split code into more files
update style to have a minimize size on each screen",Josh Marinacci,2018-05-01T17:07:08Z,joshmarinacci,joshmarinacci,2704,162,2542
27,arch-website,0e993de33cd082bf915fca0575f535263f0264ac,Merge remote-tracking branch 'origin/master',Josh Marinacci,2018-05-01T16:11:07Z,joshmarinacci,joshmarinacci,314,313,1
28,arch-website,b58cd74dead4dee9093a25194a89b6177c64e755,make the queue load the real queue from the server,josh,2018-04-24T18:06:23Z,joshmarinacci,joshmarinacci,18,17,1
29,arch-website,a3bfcb1bbd5f0da00dabae4c2089eca3b94f3bf2,move queue screen to it's own class,josh,2018-04-24T17:50:23Z,joshmarinacci,joshmarinacci,103,66,37
30,arch-website,8617793c529a06a862fe6486bd852b2173eb3f18,turn of semicolon warnings,josh,2018-04-24T17:11:35Z,joshmarinacci,joshmarinacci,8,8,0
31,arch-website,306034f0fc77632d95fa0d84adaa2ad4bb359481,change paths,josh,2018-04-21T03:10:43Z,joshmarinacci,joshmarinacci,4,2,2
32,arch-website,a3df851ccdf20096175c9393a46dcf724df9bafe,"Merge remote-tracking branch 'origin/master'

# Conflicts:
#	package.json",josh,2018-04-21T03:07:58Z,joshmarinacci,joshmarinacci,264,162,102
33,arch-website,af45f8644ecd8000824b340b82a2f2b6c3be822f,add particle tests,josh,2018-04-21T03:07:28Z,joshmarinacci,joshmarinacci,314,313,1
34,arch-website,dcf7ec3ca069b65e003867672fd9bda8654655a8,stop the animation when unmounting,Josh Marinacci,2018-04-20T18:44:53Z,joshmarinacci,joshmarinacci,5,5,0
35,arch-website,be51033ce84014a1456af6886332b9028a724a56,"added threejs
added preview of a cube",Josh Marinacci,2018-04-20T18:43:11Z,joshmarinacci,joshmarinacci,40,38,2
36,arch-website,395ddc6d5eb8f3fbe11df5640bd34c8b483f1a51,more style fixes for the preview,Josh Marinacci,2018-04-20T18:26:29Z,joshmarinacci,joshmarinacci,4,3,1
37,arch-website,bf86a210a319a3a99cea6c1a8e6a543a9f3c1d36,add mockup of the pipeline preview,Josh Marinacci,2018-04-20T18:24:41Z,joshmarinacci,joshmarinacci,52,30,22
38,arch-website,fa0747fe32f9fdfad74cadb6469ea200f3b68011,moved pipeline editor to new file,Josh Marinacci,2018-04-20T18:10:08Z,joshmarinacci,joshmarinacci,174,94,80
39,arch-website,682562b27479f2b1815dbd5f4a8df6b6e7d48ced,more styling,josh,2018-04-20T17:16:24Z,joshmarinacci,joshmarinacci,45,36,9
40,arch-website,ea690e5177bff59796a1e200b1ba7d2330ea9610,added dummy stubs for all screens,josh,2018-04-20T17:08:24Z,joshmarinacci,joshmarinacci,240,237,3
41,arch-website,6db6bf18b13f297a634975724cf29dbadae2396d,added homepage for server setup,Josh Marinacci,2018-04-10T16:39:19Z,joshmarinacci,joshmarinacci,1,1,0
42,arch-website,a3360ebdf886cd10a7709b4a081a3c869550200f,"Merge remote-tracking branch 'origin/master'

# Conflicts:
#	src/ModulePanel.js",josh,2018-04-10T16:34:06Z,joshmarinacci,joshmarinacci,79,63,16
43,arch-website,b178eb7aef017e7f22afe67dcc2fd4d7119e607d,change width and height,josh,2018-04-10T16:32:48Z,joshmarinacci,joshmarinacci,6,3,3
44,arch-website,493cfcc0184b11ac31ee0841bf298d10896fc986,"make module panels draggable, deletable
give modules random ids",Josh Marinacci,2018-04-06T18:33:15Z,joshmarinacci,joshmarinacci,79,63,16
45,arch-website,a218493d46b2960bf72b2716c18ed0e464ece2a9,"add horizontal lines example
let you add a new module to the pipeline",josh,2018-04-05T19:12:24Z,joshmarinacci,joshmarinacci,40,38,2
46,arch-website,526d123692e1c37a539ed8a777c91b7874d2365b,add tag support,josh,2018-04-05T19:02:41Z,joshmarinacci,joshmarinacci,5,4,1
47,arch-website,76b3a5b151efe868f560f0eb1010d973fabbace9,make search field work,josh,2018-04-05T19:00:14Z,joshmarinacci,joshmarinacci,36,33,3
48,arch-website,9d0de0e7453332db3b4c1bb4f896aa9f827baabc,add frames with animation at 4fps,josh,2018-04-05T18:50:38Z,joshmarinacci,joshmarinacci,85,53,32
49,arch-website,d49a6c774276356dcdf28b5a7407b312a6bb426a,implement module rendering and preview,josh,2018-04-04T22:04:06Z,joshmarinacci,joshmarinacci,134,117,17
50,arch-website,6161eb2d4cf63c11167bd44b1b5dc051dd1d7ba7,small updates,josh,2018-04-02T21:07:58Z,joshmarinacci,joshmarinacci,8,7,1
51,arch-website,0dd9e4a03b376a0bda0f50c5981cf1fa0c02084c,initial import,josh,2018-04-02T20:49:31Z,joshmarinacci,joshmarinacci,2927,2927,0
52,arch-website,29b8b2d0fe2e17ed7d60ac25a1243c2f6c53ed1a,"Merge pull request #34 from Mozilla-GitHub-Standards/master

Add Mozilla Code of Conduct",Till Schneidereit,2019-04-01T16:32:58Z,tschneidereit,tschneidereit,15,15,0
53,arch-website,3ccc8286ce7aa092a8e43275864d5443fc188d40,"Add Mozilla Code of Conduct file

Fixes #33.

_(Message COC002)_",Mozilla-GitHub-Standards,2019-03-30T06:52:41Z,Mozilla-GitHub-Standards,Mozilla-GitHub-Standards,15,15,0
54,arch-website,2af10b46802b3773c21e64ba9b0c6968b127239b,"Merge pull request #30 from mozilla/hashrouter

changing to hashrouter for now",Dan Brown,2018-10-16T05:53:29Z,slightlyoffbeat,slightlyoffbeat,3,2,1
55,arch-website,61b208a6c96ea8955df235ab0399331874e21dd9,changing to hashrouter for now,Dan Brown,2018-10-16T05:52:41Z,slightlyoffbeat,slightlyoffbeat,3,2,1
56,arch-website,46489304045061c08e7908d01207bbdcd689c7c8,add a remix button to the queue panels. fixes #24,Josh Marinacci,2018-10-05T18:48:22Z,joshmarinacci,joshmarinacci,40,35,5
57,arch-website,74c0f3211327338041ee4e6a6e4e8afa0ee2f3a2,"add notes for the workflow
save the fiddle ID in local storage. fixes #19
remove fiddle ID from local storage when successfully submitted
ignore window callbacks that aren't from webassembly studio
remove some dead commented out code",Josh Marinacci,2018-10-05T18:19:40Z,joshmarinacci,joshmarinacci,85,62,23
58,arch-website,86e680472f489af0cb27f781f764c576f198ec02,"move ThumbnailPanel to its own file
add thumbnail to the library entries. fix for",Josh Marinacci,2018-10-03T22:48:10Z,joshmarinacci,joshmarinacci,125,69,56
59,arch-website,381d44bf838811f710f159eca955174cf4c3061a,"remove threejs-particles dep
update threejs
remove jquery
fixes #29",Josh Marinacci,2018-10-03T22:38:31Z,joshmarinacci,joshmarinacci,30,4,26
60,arch-website,f32ea9db955f5a0cb240521e95ba9a01051caa48,add remix button. start for #24,Josh Marinacci,2018-10-03T22:31:27Z,joshmarinacci,joshmarinacci,1,1,0
61,arch-website,d45d3a25ee9416bf9c73b05f692f04d58f4691ba,add button to move module to the top of the queue.  fixes #22,Josh Marinacci,2018-10-03T22:29:20Z,joshmarinacci,joshmarinacci,15,14,1
62,arch-website,41509d8da2768d003ea0f1bd376d8d3a5c8bac2f,"add 'add next' button to fix #23
restyle the module panels and buttons within them",Josh Marinacci,2018-10-03T22:23:06Z,joshmarinacci,joshmarinacci,5087,2553,2534
63,arch-website,8c068df403fdd2b140033bb2d87bfbad63798db2,"Merge pull request #16 from joshmarinacci/404

temporary fix for 404 on mozilla hosting",Dan Brown,2018-06-03T09:32:19Z,slightlyoffbeat,slightlyoffbeat,19,19,0
64,arch-website,fdab4e614be017a7eb5a9456691d89207d3f2897,temporary fix for 404 on mozilla hosting,Dan Brown,2018-06-03T09:25:59Z,slightlyoffbeat,slightlyoffbeat,19,19,0
65,arch-website,094119b67ea6698735a29d868f8844dd47a6f1a5,queue display hotfix,Dan Brown,2018-06-02T11:38:54Z,slightlyoffbeat,slightlyoffbeat,5,2,3
66,arch-website,7b1eb66646563d30bc2f8eb561e2ba5e0a261f33,"Merge pull request #14 from joshmarinacci/pass-fiddles-to-wasm-studio

Expose WebAssembly Studio forks as `module=` search params on the code screen",Till Schneidereit,2018-06-02T09:53:07Z,tschneidereit,tschneidereit,22,20,2
67,arch-website,9bfe7a1584aa6b93904a9bf5b04eda7873f26ba9,"Expose WebAssembly Studio forks as `module=` search params on the code screen

WebAssembly Studio sends a postMessage to the embedding page when the project is forked. This PR adds code to update the location to include the fork's ID and passes the ID in when loading WebAssembly Studio is loaded.",Till Schneidereit,2018-06-02T08:43:15Z,tschneidereit,tschneidereit,22,20,2
68,arch-website,43ea99c6c503b058151511ca89d897c64dd3beef,"Merge pull request #13 from joshmarinacci/simplify-animation-format

Rotate frame data received from WebAssembly Studio by 180 degrees",Till Schneidereit,2018-06-01T23:10:22Z,tschneidereit,tschneidereit,3,3,0
69,arch-website,a19bf4d78965950e7c3b8b95467cd32c370da1ce,"Rotate frame data received from WebAssembly Studio by 180 degrees

The mapping of pixels to the Arch is highly unintuitive, and we want to avoid exposing this to users. The mapping is much easier to reason about if the pixels are rotated by 180 degrees, i.e. if the first pixel becomes the last, and vice versa.

The previewer has the inverse mapping, so to keep that the way it should be, we just rotate the 3D model by 180 degrees.",Till Schneidereit,2018-06-01T23:06:32Z,tschneidereit,tschneidereit,3,3,0
70,arch-website,46c8b0b60239c6795fddff587044eeb9dcff9ecf,"Merge pull request #12 from joshmarinacci/new-sort

Fix sorting bug",Dan Brown,2018-06-01T22:50:47Z,slightlyoffbeat,slightlyoffbeat,119,65,54
71,arch-website,a25b3b6450102b9b18d589143f37c434aae20a7a,Fix sorting bug,Dan Brown,2018-06-01T22:50:20Z,slightlyoffbeat,slightlyoffbeat,119,65,54
72,arch-website,6755b5b7d6cfcf57cfc682e68bf3ca34098b1fed,"Merge pull request #11 from joshmarinacci/simplify-animation-format

Simplify the format of animations as received by WebAssembly Studio",Josh Marinacci,2018-06-01T20:13:38Z,joshmarinacci,joshmarinacci,148,44,104
73,arch-website,e82768770b1376814b40274658c65e7b2df0546b,"Simplify the format of animations as received by WebAssembly Studio

Currently animations are encoded to JSON by WebAssembly Studio and then immediately decoded into ImageData objects by the website. This patch changes the website to expect a single ArrayBuffer containing the entire animation, which is what WebAssembly Studio uses internally.

On the WebAssembly Studio side the new format can be sent with a simple template change.

The patch also removes the rotation of incoming frames, as we can adapt the templates to not need that. In fact that's much better because otherwise the mental model for how to map pixels to the Arch is more difficult.",Till Schneidereit,2018-06-01T19:59:21Z,tschneidereit,tschneidereit,148,44,104
74,arch-website,5c75ac7c8f730de0c71d56ed9f1df5dfff149438,"Merge pull request #10 from ashleygwilliams/rust-links

Rust links",Lin Clark,2018-06-01T12:26:55Z,linclark,linclark,54,39,15
75,arch-website,2c33052b31c935ab629eba591ab1ab4482a60d6f,feat(footer): add Rust links,Ashley Williams,2018-06-01T12:20:48Z,ashleygwilliams,ashleygwilliams,54,39,15
76,arch-website,b56ad40d3dec1869b8b6d48468bed11ea7dac5ea,"Merge pull request #9 from ashleygwilliams/patch-1

fix(readme): s/npm run start/npm start",Lin Clark,2018-06-01T12:07:32Z,linclark,linclark,2,1,1
77,arch-website,225e8df6f158644a9eec91f4c418c11f005b2034,"fix(readme): s/npm run start/npm start

`npm start` is a special command and does not require the `run` element to invoke!",ashley williams,2018-06-01T12:06:01Z,ashleygwilliams,ashleygwilliams,2,1,1
78,arch-website,b7a5fedf00c2b5d43d05f89fb2a6cb70a01a7397,fix canvas rotation in the 3d arch view,josh,2018-06-01T07:19:31Z,joshmarinacci,joshmarinacci,8,7,1
79,arch-website,a99db97131ac53d4b595ad82f821d00860dd94a2,Merge remote-tracking branch 'origin/master',josh,2018-06-01T06:43:42Z,joshmarinacci,joshmarinacci,260,136,124
80,arch-website,c85c159e105a4e8ba103e50114896fb6cb5f549b,"add a link to view the raw json
make images cross origin
rotate the image when it first comes in from the wasm studio for both the thumbnail and the data",josh,2018-06-01T06:42:03Z,joshmarinacci,joshmarinacci,35,33,2
81,arch-website,d935a31ba3408ef32e4b618401cb936da33532b1,"GA, Remove Footer Links, updated Copy.",Dan Brown,2018-06-01T00:59:06Z,slightlyoffbeat,slightlyoffbeat,260,136,124
82,arch-website,fd04f236ab4bf88d028c89f70ea72f895c4aa4fd,"remove dead code
swap rows and cols in the Archway to match up with the data we get from WASM studio
remove rows and cols in the Constants",josh,2018-05-31T18:20:01Z,joshmarinacci,joshmarinacci,52,1,51
83,arch-website,006544ae91e0f681f1a8c9684b3e82ea29aec9aa,add gray rect for debugging,josh,2018-05-31T17:15:04Z,joshmarinacci,joshmarinacci,18,16,2
84,arch-website,fe3b9c9606267ebb1ab1d609744fa68fc2b33494,"rewrite the QueueModulePanel to fully separate the 2d and 3d cases
make the ThumbnailPanel redraw itself once the image is loaded
make the ModuleStore fire a thumbnail event when a thumbnail is loaded",josh,2018-05-31T17:06:27Z,joshmarinacci,joshmarinacci,205,72,133
85,arch-website,3b03052cff5335b953f6afa3ce440df6d07f87be,"show the author, description, and module id in the queue editor",josh,2018-05-31T04:14:34Z,joshmarinacci,joshmarinacci,17,14,3
86,arch-website,0a7bf77ddf318c8011f81c23ae229cb4aac02cb9,"add listener for when the modules changes in the QueueEditor screen
add button to the list of modules to archive them
format the timestamp, if available
add ModuleStore.archiveModule to archive a given module, then refresh the local list",josh,2018-05-30T22:12:34Z,joshmarinacci,joshmarinacci,91,71,20
87,arch-website,da26af250ca425af55b31b33ebceca29aaadd04c,"Merge pull request #7 from joshmarinacci/codepage-style

styling the code screens",Dan Brown,2018-05-30T16:37:53Z,slightlyoffbeat,slightlyoffbeat,573,426,147
88,arch-website,28d0784d366f1a4dd5b4d9cf8a860f2b8ddab97a,cleanup to remove some build warnings,josh,2018-05-30T16:34:25Z,joshmarinacci,joshmarinacci,27,6,21
89,arch-website,c15497471b47a147693e7b439fa080d2e10529cf,remove the 'homepage' property from the package.json,josh,2018-05-30T16:13:55Z,joshmarinacci,joshmarinacci,1,0,1
90,arch-website,a9893f62ff84113cc4fe24e7e5fa01a551a955c7,"make the home screen fetch the queue when it loads
delete some dead code",josh,2018-05-30T16:10:37Z,joshmarinacci,joshmarinacci,201,98,103
91,arch-website,02b7a562eb9414c1948903b74672e58ff01fec3b,styling the code screens,Dan Brown,2018-05-30T15:32:51Z,slightlyoffbeat,slightlyoffbeat,573,426,147
92,arch-website,f9e4404727556475e9d8f3e3fc6a9743b1d726f3,updated icons,Dan Brown,2018-05-29T18:10:57Z,slightlyoffbeat,slightlyoffbeat,82,70,12
93,arch-website,f5a35306bfc629fc73c5cb332b8c53806f016d6a,better min-height for content,Dan Brown,2018-05-29T18:07:49Z,slightlyoffbeat,slightlyoffbeat,28,14,14
94,arch-website,5a4228281786e4ed0c7c28e95d362c28e9f33474,hide the Queue Editor link if the user isn't an admin user,josh,2018-05-29T16:57:31Z,joshmarinacci,joshmarinacci,11,9,2
95,arch-website,dc343eaaf27b18cde28e3c685dd947aa291c1006,add font-awesome back,josh,2018-05-29T16:47:39Z,joshmarinacci,joshmarinacci,6,6,0
96,arch-website,a322f930b1334bc3ff09dccc1e4239c671ae5732,remove font awesome,Dan Brown,2018-05-29T15:52:42Z,slightlyoffbeat,slightlyoffbeat,6,0,6
97,arch-website,95850bff6f7bbad5542ca1effa8a9b5cd902522e,better border for user profile photo,Dan Brown,2018-05-29T15:22:19Z,slightlyoffbeat,slightlyoffbeat,37,29,8
98,arch-website,f62808d6aa29417247b0b586774b1a6e18859418,"Merge pull request #6 from joshmarinacci/style-queue

styling queue page.",Dan Brown,2018-05-29T14:58:51Z,slightlyoffbeat,slightlyoffbeat,1090,603,487
99,arch-website,44e2c93c696b5b5e76c2b7dc6f46a00ea6e34e63,styling queue page.,Dan Brown,2018-05-29T14:54:40Z,slightlyoffbeat,slightlyoffbeat,1090,603,487
100,arch-website,5b4b7e0770661f763e14654f9222c0ed2b052126,"GA, favicons, and metadata",Dan Brown,2018-05-29T12:04:21Z,slightlyoffbeat,slightlyoffbeat,23,20,3
101,arch-website,703f58cd174d11f7ae226ee5d8556f20b22f7d26,"Merge pull request #5 from joshmarinacci/about-page

About page & navbar improvements",Dan Brown,2018-05-29T11:42:38Z,slightlyoffbeat,slightlyoffbeat,2570,2180,390
102,arch-website,63079f0e747c8482178431aa4fb715d5fee64cdc,adding github profile photo when logged in,Dan Brown,2018-05-29T11:40:06Z,slightlyoffbeat,slightlyoffbeat,84,71,13
103,arch-website,79465591a718186687de839478821cfae888ec62,Pattern Component,Dan Brown,2018-05-28T15:13:30Z,slightlyoffbeat,slightlyoffbeat,2195,1818,377
104,arch-website,d597a5c2bc9a18058487932f0e005716c9f9441d,adding images and additional responsive styles for about page,Dan Brown,2018-05-28T12:10:17Z,slightlyoffbeat,slightlyoffbeat,59,45,14
105,arch-website,1d516f62a639c8dc54baeef9aeafc1e298e8791a,starting about page copy + styles,Dan Brown,2018-05-27T01:47:20Z,slightlyoffbeat,slightlyoffbeat,274,267,7
106,arch-website,d9bcfab6e1bb76f71b139fe9a77a655677e8f23a,"change rendering order in the Archway three animation so it stops on crash
convert data from postMessage directly into ImageData
convert ImageData to PNGs before submitting it to the server",josh,2018-05-25T04:11:05Z,joshmarinacci,joshmarinacci,94,73,21
107,arch-website,35ae53063770a593ecce9a5a313b1cb016f602fa,"encode frames as PNGs when saving
decode frames as ImageData when loading and rendering in 3D",josh,2018-05-24T21:57:40Z,joshmarinacci,joshmarinacci,78,54,24
108,arch-website,e0f9ef87ac7aa93bb3fffea658c74f3eede32c88,"print errors when fetch requests fail
add content length to the post
print the size of the post before posting",josh,2018-05-24T20:18:56Z,joshmarinacci,joshmarinacci,51,32,19
109,arch-website,19de66e6d4876d8bb5e206a5806055660247a312,"make the Footer aware of it's context
don't render the footer if we are on the /code path
make the code editor slightly shorter so it won't usually scroll",josh,2018-05-23T19:37:18Z,joshmarinacci,joshmarinacci,308,163,145
110,arch-website,1cea52cc3a08e7923667ba30b5a273163e289158,"ignore postMessage callbacks that come from somewhere other than the webassembly.studio domain
add an error dialog
show error if can't get message from studio
show error if publishing throws an error
show error if publishing returns success == false
show error when missing fields
add progress spinner to the progress page",josh,2018-05-23T18:45:04Z,joshmarinacci,joshmarinacci,128,87,41
111,arch-website,0b62ccbc67afc5565483d35dca50f6fce7d1295f,"fix the link to the code screen on the home screen
generate a data URL in PNG for the thumbnail from the first frame of the animation
make the QueueModulePanel draw using a thumbnail if in 2d mode
cache the images so we don't have to regenerate them constantly",josh,2018-05-23T00:01:31Z,joshmarinacci,joshmarinacci,78,65,13
112,arch-website,35e5db863c6f4db29ac1813debef506437918fcd,make the queue screen fetch the first item separately from the rest,josh,2018-05-22T22:02:52Z,joshmarinacci,joshmarinacci,18,14,4
113,arch-website,b08ada89a8d151d699c8f6069c8c7acc83a01e01,"restyle the queue screen
fix crash when module is missing
refresh the queue screen once the queue is loaded",josh,2018-05-22T20:46:38Z,joshmarinacci,joshmarinacci,94,78,16
114,arch-website,07b7c1c1366185f27b3446685bef2339aa839808,"restyle the module submission screen
don't use local storage for the module anymore
make the tag editor work again",josh,2018-05-22T18:13:19Z,joshmarinacci,joshmarinacci,127,99,28
115,arch-website,e0ca0595d49f283bd72b76ef104c3e879245c538,render the current username in the login/logout button,josh,2018-05-22T17:27:36Z,joshmarinacci,joshmarinacci,1,1,0
116,arch-website,e2208a6c949cd98d8d24d34694d1ed31f28a4744,"improve button styling on code screen
make the queue button on the home screen be a Link that works",josh,2018-05-22T17:24:55Z,joshmarinacci,joshmarinacci,15,7,8
117,arch-website,4a8b365a05016448ce1cce475ec804acdd2437e0,"fix crash with missing module
fetch the module from the queue for the home page
show the queue module in the home page
remove the other ways to get started on the home page",josh,2018-05-22T16:32:25Z,joshmarinacci,joshmarinacci,74,39,35
118,arch-website,89a7c4c19c0830b380827e3ab8189cca47cc2a8e,Adding npm script for staging.,Dan Brown,2018-05-22T02:13:29Z,slightlyoffbeat,slightlyoffbeat,6,5,1
119,arch-website,13f7e0069bd618167ec435b8d4b40eec35c7dfe4,"rewrite the code screen to use overlay for all states
add an info screen to provide useful info to someone when they first come to the code screen
combine preview and submit screens
add progress screen while submitting (needs a spinner)
make the code editor slightly shorter",josh,2018-05-21T21:55:47Z,joshmarinacci,joshmarinacci,213,129,84
120,arch-website,dc0151a2990b50162ae357fc41a8abb49d8aa31d,"fix crashing on malformed animation data
add wasmstudio origin",josh,2018-05-21T20:10:42Z,joshmarinacci,joshmarinacci,4,4,0
121,arch-website,44d036393e70a0e2e7807038fb586c900360af1f,"make the github button show you your current logged in status
use buttons for the preview back and submit links",josh,2018-05-21T19:14:20Z,joshmarinacci,joshmarinacci,34,24,10
122,arch-website,000e5d1c8ae5d1ec6d770bf96f33bec1745efff7,make the preview be an overlay,josh,2018-05-21T18:54:04Z,joshmarinacci,joshmarinacci,79,66,13
123,arch-website,fcd8e0751fba15afab5a9c0c4953dbe6f0de7dfd,clean up buttons,josh,2018-05-16T21:53:17Z,joshmarinacci,joshmarinacci,18,7,11
