,reponame,commitid,commitmsg,commitauthor,commitauthordate,comauthorlogin,shaauthorlogin,stats_total,stats_addns,stats_delns
0,batucada,b5ce4c58d8cc4e8f0c53b7fc42180e29b6a9d559,Allow users to reset their password after verifying their email address.,Paul Osman,2010-08-05T20:46:58Z,paulosman,paulosman,252,245,7
1,batucada,4929abdca748e23bca5601c73cbb3e99bde07ad5,Fix dashboard test. Don't check for redirect to profile create anymore,Paul Osman,2010-08-05T20:44:03Z,paulosman,paulosman,11,2,9
2,batucada,222dae351527a8f9aadfe90fe19ac39bb7cbc53a,More robust checking in errors template,Paul Osman,2010-08-05T16:50:28Z,paulosman,paulosman,2,1,1
3,batucada,67eb2e95adc4b9e403160c84f868569dd8f21fb7,Let's not force any kind of registration workflow for now.,Paul Osman,2010-07-30T19:15:40Z,paulosman,paulosman,13,5,8
4,batucada,83fb10d12c0a1a3f4f944238d240423f26db37f5,Return 404 for profiles that do not exist,Paul Osman,2010-07-30T15:40:45Z,paulosman,paulosman,6,5,1
5,batucada,9ef38b6d30faabc121baf3e7d362ce2bcb70b1d4,"Purging the word 'My ' to prefix anything. I hate that convention, don't know why I typed that.",Paul Osman,2010-07-29T21:02:46Z,paulosman,paulosman,10,5,5
6,batucada,a49179b11b2e44758b358e9f2ba4758b4311b480,Moving users.models.authenticate to users.auth.authenticate,Paul Osman,2010-07-29T20:25:44Z,paulosman,paulosman,41,21,20
7,batucada,bd576cd834c246f76512d0696fe445049156c22e,"Very basic user listing, follow / unfollow functionality",Paul Osman,2010-07-29T20:11:43Z,paulosman,paulosman,218,215,3
8,batucada,3cbf1250c0df0d11929f3acd48bb0e6991df9c1e,Adding some tests to dashboard and users apps,Paul Osman,2010-07-29T01:23:54Z,paulosman,paulosman,96,96,0
9,batucada,01c6cd61be530f2f32a1cbf5abf9e62d9e5b6eed,Wrote a decorator called anonymous_only for views where I want to redirect the user if they have an active session.,Paul Osman,2010-07-29T01:22:03Z,paulosman,paulosman,22,22,0
10,batucada,6bc01b6ff7b00bb10768181f53799341cfd4abeb,Add a password label to the login form,Paul Osman,2010-07-29T01:16:13Z,paulosman,paulosman,1,1,0
11,batucada,ce045ef897dfcb77fbbb615cc3e7b50c758876bd,Removing a redundant check,Paul Osman,2010-07-29T01:15:54Z,paulosman,paulosman,2,0,2
12,batucada,37e1104c22e6c3ac5bd97acae0d120fd676b436c,Add a models.py file to dashboard app so that the django test runner can find it,Paul Osman,2010-07-29T01:15:34Z,paulosman,paulosman,1,1,0
13,batucada,bf6547fdfb700b713809a51d856f05056c198754,Adding empty models.py to l10n app so DjangoTestRunner can find it.,Paul Osman,2010-07-28T02:58:15Z,paulosman,paulosman,0,0,0
14,batucada,8088232ef493cbd9d66dd3dc70c394214516a662,Adding some tests to locale url middleware,Paul Osman,2010-07-28T01:21:08Z,paulosman,paulosman,55,55,0
15,batucada,7f9f66390a854d8d43e7bcab4643941e7ccf2e66,Being a bit more defensive,Paul Osman,2010-07-28T01:20:18Z,paulosman,paulosman,4,4,0
16,batucada,adbdec9da36a0afad5d80c42eba0fd53a37375d7,Minor css tweak to reflect recent changes to templates,Paul Osman,2010-07-27T17:21:45Z,paulosman,paulosman,2,1,1
17,batucada,3fba4dac4ffa7e975db9cb0faf2761023fa0c67b,"Pretty major refactoring. Punting on any javascript / ui work and have everything handled in it's own view now. Will sprinkle on UI magic when structure is more determined. Also, user profiles",Paul Osman,2010-07-27T17:21:45Z,paulosman,paulosman,646,305,341
18,batucada,d3a659b33b14e52fd67e7e4a53495f88bc40f5c9,Add django-profile to requirements and make necessary changes to settings.py to get user profiles working,Paul Osman,2010-07-27T01:56:44Z,paulosman,paulosman,5,5,0
19,batucada,d30fcdf7803103edb39bde33de714023db9aec9a,Create a basic model for user profiles.,Paul Osman,2010-07-27T01:56:08Z,paulosman,paulosman,13,12,1
20,batucada,3a9e5a39ddd205a1e212f81dc7168146735a006f,Rewrote a block of auth code to be more bookish,Paul Osman,2010-07-26T21:55:16Z,paulosman,paulosman,30,15,15
21,batucada,34697504fde21222ca9f47acd605cee670c3bc08,Not using the django-registration application anymore.,Paul Osman,2010-07-26T02:48:02Z,paulosman,paulosman,5,0,5
22,batucada,e6f9e94107428fc5494cfc1977e18cd93daaaaec,Get rid of registration templates. Not using django_registration for much right now,Paul Osman,2010-07-23T18:16:27Z,paulosman,paulosman,18,0,18
23,batucada,a9fe09f2b5e3896c99012b47511f6c5347be46c7,Allow users to sign up using an OpenID.,Paul Osman,2010-07-23T18:14:24Z,paulosman,paulosman,112,77,35
24,batucada,976679e5f4ff892420175a54e087a2ab27f3e4b1,Move javascript into a single file,Paul Osman,2010-07-23T18:14:04Z,paulosman,paulosman,62,36,26
25,batucada,d9486a350951e23ea0d26fb6c1a34f3ec9a79022,Whoops. Duplicate import,Paul Osman,2010-07-23T18:11:55Z,paulosman,paulosman,1,0,1
26,batucada,96036b529c6f78589dc5192e0d45a670457e9fdb,Basic username / password registration working,Paul Osman,2010-07-23T03:10:40Z,paulosman,paulosman,189,168,21
27,batucada,e3762b1167421fa7bbdddbff7602a18e88b2f91f,Add a personalized message just to test user models,Paul Osman,2010-07-23T01:53:56Z,paulosman,paulosman,6,4,2
28,batucada,3a8e18ec6a01b8e31cf364e4148466a032f73aa2,Remove openid login template.,Paul Osman,2010-07-23T01:53:40Z,paulosman,paulosman,20,0,20
29,batucada,b849825d06b3a28c59295bccfdf79536b8d500a6,Basic OpenID login working. Wraps functions in django_auth_openid in order to create accounts on registration but not sign in.,Paul Osman,2010-07-22T03:13:18Z,paulosman,paulosman,373,367,6
30,batucada,97734345ea06ee17d72ce7694862c5ad8e24f967,Adding jquery,Paul Osman,2010-07-22T02:52:49Z,paulosman,paulosman,154,154,0
31,batucada,3c5e8f5b5172c4aac4b40fbd348ae47ef120cfcd,Show one 'dashboard' view to unauthorized users and a personalized one to authorized users,Paul Osman,2010-07-22T02:51:49Z,paulosman,paulosman,10,4,6
32,batucada,46b0db477ff1c6825b0dab98fd21b1ba680f4054,Make the dashboard.views.index view the default (root) view,Paul Osman,2010-07-22T02:51:08Z,paulosman,paulosman,4,1,3
33,batucada,7d50955bd7a5461114c34abe66e17d75143ea37f,Make manage.py executable,Paul Osman,2010-07-22T02:50:43Z,paulosman,paulosman,0,0,0
34,batucada,21f1497d27ead18db8160ad9f0fe322b03d42a2a,Move dashboard template out of application.,Paul Osman,2010-07-22T02:49:24Z,paulosman,paulosman,17,7,10
35,batucada,34255075885d1b8d111f0e729f726e2eb2d611b4,Fixing typo in requirements.txt,Paul Osman,2010-07-21T02:12:35Z,paulosman,paulosman,2,1,1
36,batucada,9f2ce4d3a591f0ee410ef816802db666e532de54,"Include django_openid_auth in requirements, override login view",Paul Osman,2010-07-15T20:44:34Z,paulosman,paulosman,47,44,3
37,batucada,cd964037630f16ce1df3404b1b559e7f1b9d60f7,Require login to visit dashboard,Paul Osman,2010-07-15T20:43:49Z,paulosman,paulosman,3,3,0
38,batucada,78b8ddd1c4b9e8db28fa722f1fd28571468e2dcc,Ignore database files and locale directory,Paul Osman,2010-07-15T20:42:34Z,paulosman,paulosman,2,2,0
39,batucada,5808208c386e9e7e5a361346b599223be479c5a5,Adding MPL license file,Paul Osman,2010-07-15T20:00:31Z,paulosman,paulosman,37,37,0
40,batucada,ba9939ef7db709c79aa3c50eb86daf639b0b4b55,Let's start tracking those requirements,Paul Osman,2010-07-15T19:54:13Z,paulosman,paulosman,4,4,0
41,batucada,8f7491fa17d6e435585cea4ea663933c22bf130e,Cobbled together some i18n/l10n code from kitsune and amo for use in batucada,Paul Osman,2010-07-15T19:53:02Z,paulosman,paulosman,210,210,0
42,batucada,1d7ecc2a099ee4b6c0f84118070ec2cc56f164a8,Adding a dashboard app with a stubbed out view. Will use to test auth and l10n components.,Paul Osman,2010-07-15T19:22:52Z,paulosman,paulosman,39,27,12
43,batucada,51fa0bfe89351247b36306fb6c8834f41311e83e,Ignore python bytecode files,Paul Osman,2010-07-15T19:22:03Z,paulosman,paulosman,1,1,0
44,batucada,25743c8080e589a6190b485a3eed699ddf863732,Tell manage.py where to look for apps,Paul Osman,2010-07-15T18:26:45Z,paulosman,paulosman,9,9,0
45,batucada,c5e4414e83da04e52183809d3fe4de4ed76f6b47,Tweaks to project settings.,Paul Osman,2010-07-15T17:14:49Z,paulosman,paulosman,28,14,14
46,batucada,ff5e59aee4bd1689e4155c721a43733a80668fad,Initial commit for batucada,Paul Osman,2010-07-15T16:11:55Z,paulosman,paulosman,122,122,0
47,batucada,76a9d07e5a4d3d36267f15d9a4731bcc13b65391,removed links and phone from public profile,theinterned,2010-10-04T15:30:49Z,theinterned,theinterned,19,1,18
48,batucada,abae0c86ffa973453d1b7e8a2ed02b53d1bb9b52,removed links and phone from profile manu - KISS,theinterned,2010-10-04T15:28:31Z,theinterned,theinterned,4,1,3
49,batucada,296a935c803cbc7159d1c77e9a85e241d991ff9a,Merge remote branch 'upstream/master',theinterned,2010-10-04T15:12:26Z,theinterned,theinterned,68,41,27
50,batucada,f0ccb3fd1e41a5cacb9c0a5a3cf72a6851911cde,Prepend paths with MEDIA_URL,Paul Osman,2010-10-04T14:16:16Z,paulosman,paulosman,4,2,2
51,batucada,67d114d7897102521bbe97d5150d64df677861d4,Use a decorator for l10n template tags (we use them elsewhere anyway) and give the activity model a sensible plural name,Paul Osman,2010-10-02T17:06:43Z,paulosman,paulosman,9,6,3
52,batucada,81df759a08098fdafa7bc7538a4bd8123ae6e130,Giving the activity feed on the dashboard a little pizazz. And by pizazz I mean something other than an unstyled unordered list. IANAD -- I am not a designer,Paul Osman,2010-10-01T22:08:07Z,paulosman,paulosman,12,11,1
53,batucada,b5b53e071164675e181e91a6aedf9179f457f81b,"Use django_nose for tests. Also, move importing of settings_local to manage.py",Paul Osman,2010-10-01T19:10:39Z,paulosman,paulosman,45,23,22
54,batucada,473560bc245234ff24567a1f46df0cfac794bf2b,Fix typo in reset_password.html template,Paul Osman,2010-10-01T19:10:01Z,paulosman,paulosman,2,1,1
55,batucada,b56a53c68d721d9d1c84873c51f70a544c04f6ce,restored profile edit nav classes,theinterned,2010-09-30T20:31:02Z,theinterned,theinterned,12,6,6
56,batucada,8d3359225f6397f3a7bf01227b3993848e946c3b,Add placeholder nav for unauthenticated users,Paul Osman,2010-09-30T20:18:42Z,paulosman,paulosman,20,14,6
57,batucada,49e280172011878d667ddcb61fc9ac04e0a3331c,Created locale_url custom tag in l10n application.,Paul Osman,2010-09-30T20:03:02Z,paulosman,paulosman,171,123,48
58,batucada,7382eb83ee5361612da2d0dc9ccba1c12463235a,Merging in ned's latest ui work,Paul Osman,2010-09-30T15:55:54Z,paulosman,paulosman,183,141,42
59,batucada,25aa267085f1e1ddd4598ca346c143d10a256f50,Skip email verification if working in debug mode.,Paul Osman,2010-09-30T15:37:35Z,paulosman,paulosman,22,14,8
60,batucada,8846d40db58db4bbcd11aac6b75e1d80be4da807,Merge branch 'decoupling',Paul Osman,2010-09-30T15:21:27Z,paulosman,paulosman,416,219,197
61,batucada,de7a39e10396526f9d2f369ef2a03bae685f2a8e,Wrap l10n imports in try...except falling back to django.core.urlresolvers.reverse,Paul Osman,2010-09-30T02:47:25Z,paulosman,paulosman,46,35,11
62,batucada,c89ad5f052783104d6eaa7b06250a141d8a10ebc,Dropping jingo for now to make batucada a bit more vanilla. May come back to it later cause I'm going to hate writing ifequal,Paul Osman,2010-09-30T02:08:50Z,paulosman,paulosman,1,0,1
63,batucada,fda921e47882dabff7030476979195fb5e8832b4,updated the edit profile nav as well as set up some general nav styles and patterns,theinterned,2010-09-29T21:03:16Z,theinterned,theinterned,93,81,12
64,batucada,8cf6b9bcffc2be4e95796f4136ca7e1fb36a9a89,Merge remote branch 'upstream/master',theinterned,2010-09-29T17:14:39Z,theinterned,theinterned,13,12,1
65,batucada,858b0a3913baeefaf5146ff4aca72d3aa310fdab,"No longer using jinja, no  need for l10n helper",Paul Osman,2010-09-29T15:29:06Z,paulosman,paulosman,7,0,7
66,batucada,f1d08e56e995a4f320ea29ce09be0623d357aa89,Remove l10n module until I can figure out a way of using it in applications without introducing too much coupling,Paul Osman,2010-09-29T14:16:48Z,paulosman,paulosman,2,1,1
67,batucada,b7fd9c7ba26fea46d9a7dbf6a5b36bab94612ec0,Jinja -> Django templates,Paul Osman,2010-09-29T14:14:31Z,paulosman,paulosman,142,71,71
68,batucada,7f3ec4f66ac4e382218a095cef8794f4d486263c,Add pil to requirements.txt,Paul Osman,2010-09-29T01:43:12Z,paulosman,paulosman,6,1,5
69,batucada,2422f58a69800f51ea58a1f13a0f3aa00df41188,Merge branch 'master' of http://github.com/rgardler/batucada into rgardler-master,Paul Osman,2010-09-29T01:40:10Z,paulosman,paulosman,15,15,0
70,batucada,95e3c9510beed9b9e94ce3589f7aa11d843dddb3,"Add ability to override default settings using a local settings file.

Also note need to install PIL",rgardler,2010-09-28T23:31:50Z,SorraTheOrc,SorraTheOrc,15,15,0
71,batucada,3294bd9be724e15af9cbba52c91c82be771b7ad4,added proper margin to paragraphs,theinterned,2010-09-28T22:22:10Z,theinterned,theinterned,4,3,1
72,batucada,212f1e9a681074941f9159aad462f4186b9a6b6d,more tweaks to forms,theinterned,2010-09-28T22:21:34Z,theinterned,theinterned,8,6,2
73,batucada,fe92defbd5afa602671c7cc847d3c7a2018f64eb,factiored a lot of form styles up from the signin to the general forms section of the css,theinterned,2010-09-28T21:57:25Z,theinterned,theinterned,98,58,40
74,batucada,8e2d644c58e42161126aeaa9726f5dedbbe70f8c,tightend up signin forms,theinterned,2010-09-28T21:15:37Z,theinterned,theinterned,16,10,6
75,batucada,c3d7833b6ef15beb8416aa79b0b2f0037bb3ad07,"Experimenting with decoupling applications (remove dependencies on jingo, l10n, etc)",Paul Osman,2010-09-27T22:18:16Z,paulosman,paulosman,224,115,109
76,batucada,2c277c197b36c939b7522180ace9db846c96e7e8,Just changing the Github URI in README.rst,Paul Osman,2010-09-27T20:26:04Z,paulosman,paulosman,2,1,1
77,batucada,8adeab0c9e67ba8bda8b1c04babc0795ac55b662,"Git, stop bugging me about uploaded files",Paul Osman,2010-09-25T01:49:03Z,paulosman,paulosman,1,1,0
78,batucada,ed6ca31165dfb112c02422e5449ad95024f89610,Remove redundant nav from dashboard template,Paul Osman,2010-09-25T01:38:41Z,paulosman,paulosman,8,0,8
79,batucada,188046c5217605cf0b2a6227805c357f2e8e3200,Just use local jQuery. Also removing an unnecessary slash and other minor fixes,Paul Osman,2010-09-25T01:00:53Z,paulosman,paulosman,8,3,5
80,batucada,256d4766c91e2be2bc64248652376d0b7bd91871,Merge branch 'master' of http://github.com/theinterned/batucada into basic-theme,Paul Osman,2010-09-25T00:49:03Z,paulosman,paulosman,1174,1056,118
81,batucada,5070cff5fcc86966dbad93007ba505aca174ab58,Don't prefix person objects with 'a person:' in html activity representations,Paul Osman,2010-09-24T17:51:54Z,paulosman,paulosman,4,2,2
82,batucada,f540ef12b68941673009d34a0635423efdeab500,laid out and styled all screens for signup and signin,theinterned,2010-09-24T17:50:10Z,theinterned,theinterned,254,144,110
83,batucada,e9396549e423b62ae78b46f814dfa23999ddf8b6,created drumbeat favicon,theinterned,2010-09-24T16:43:34Z,theinterned,theinterned,1,1,0
84,batucada,182f0d59604ffb5bebbdb17ed54fd0eb493b2dbe,added a class to the html tag to indicate the current page,theinterned,2010-09-22T20:50:20Z,theinterned,theinterned,11,10,1
85,batucada,f35d0cff851d8f06711a22c0cf38961a3b997584,added dashboard to nav links (repeating header home link),theinterned,2010-09-22T20:35:35Z,theinterned,theinterned,1,1,0
86,batucada,3bcab49ea3f1e538a0e5a1bd6b2098bffdc3e574,"basic grid sturcture, typography and header nav worked out",theinterned,2010-09-22T20:32:36Z,theinterned,theinterned,79,67,12
87,batucada,26f7af3724381644d1890530582e6e0a0f6d732b,Merge branch 'activity',Paul Osman,2010-09-22T19:59:32Z,paulosman,paulosman,760,722,38
88,batucada,ed52a3a2bace2c5b0e39d972c45f184a4bd29fb4,Adding some tests to the activity application.,Paul Osman,2010-09-22T19:57:09Z,paulosman,paulosman,97,97,0
89,batucada,73b27cda80f5953ff0e68c4da35740211bce1f2d,Fix activity manager functions to work with contenttypes.,Paul Osman,2010-09-22T19:56:45Z,paulosman,paulosman,43,33,10
90,batucada,9373716d300bc278ab3dc50772b1e4dc2ebad2da,Moving object_type function from feeds.py to schema.py. Also fixing a small bug where activity stream objects were getting a double '/',Paul Osman,2010-09-22T19:55:26Z,paulosman,paulosman,44,23,21
91,batucada,52de67be220bf3aeb9f213468cf5365f3909ac37,Return the activity object after creating it. Makes it easier to test.,Paul Osman,2010-09-22T19:54:10Z,paulosman,paulosman,1,1,0
92,batucada,f9bf1754acb7c9eb7ca874721efc79b1e497bb72,Add a simple 404 template so exceptions aren't thrown when debugging is turned off,Paul Osman,2010-09-22T19:53:46Z,paulosman,paulosman,1,1,0
93,batucada,e8ec0743c3e4a98639c57abd2986921bd4ac0a7d,"added select bits from html5 boilerplate to get base front end dev envirion ready: modernizer, jquery, belatedpng, base.css reset, plcaeholder for jquery lugins (plugins.js), placeholder for site scripts (scripts.js)",theinterned,2010-09-21T22:02:57Z,theinterned,theinterned,832,829,3
94,batucada,714c4f1b44d6ef9f613c61e86af21bbb0630e15a,Modify activity stream feed generator to support activities that have targets,Paul Osman,2010-09-21T21:15:35Z,paulosman,paulosman,51,34,17
95,batucada,67f04c83dc9e33c9f79342144b1ee51baa1bfa98,"Cleaning up, removing code that isn't used, etc.",Paul Osman,2010-09-21T21:03:12Z,paulosman,paulosman,117,64,53
96,batucada,47ad1eb3766ad3a61c7cf36932bd34be98c05f75,Prefix activity object with 'a' or 'an' and the object type as necessary. E.g. Paul created __a project:__ My New Project,Paul Osman,2010-09-21T20:25:41Z,paulosman,paulosman,40,34,6
97,batucada,d1f5770a5a707f33f7ce192e9368cdb91e7411b9,"If an activity information item is a specialization, add the generalization to the atom feed.",Paul Osman,2010-09-21T18:33:21Z,paulosman,paulosman,203,116,87
98,batucada,e938c383d2a63eecdaa152f8cd72b8e6546d8165,updated with basic html5 markup and minimal nav,theinterned,2010-09-21T19:04:38Z,theinterned,theinterned,16,14,2
99,batucada,d229cc6b3f3d742fd38d7389c30273ae696a6bab,Store the full IRI for activity stream information items,Paul Osman,2010-09-21T18:10:17Z,paulosman,paulosman,36,24,12
100,batucada,ac55ec8066170f6c68e5faa832625066a7456518,Add content element to atom user feeds,Paul Osman,2010-09-21T18:09:29Z,paulosman,paulosman,5,5,0
101,batucada,0d590ae5eaa33b45d192573c05e49fd32f41698b,Getting closer to having actual atom feeds with activity extension,Paul Osman,2010-09-20T22:31:50Z,paulosman,paulosman,47,39,8
102,batucada,8b651df15dcb3fd3e84e990fd8a71f4fbf854b81,Adding commonware to requirements.txt and middleware for blocking out passwords on exception reports,Paul Osman,2010-09-17T20:29:38Z,paulosman,paulosman,2,2,0
103,batucada,3588b37a466910a73188bd2f7b61962657999eb6,Moved activity rendering out to a partial template,Paul Osman,2010-09-16T20:03:52Z,paulosman,paulosman,87,53,34
104,batucada,c4710100712a62027fb967fd260830188294d04a,Merge branch 'activity' of github.com:paulosman/batucada into activity,Paul Osman,2010-09-15T13:47:59Z,paulosman,paulosman,65,59,6
105,batucada,5655253ff3cb1fd33d0bd404051a1021d47d2e18,Merge branch 'master' of github.com:paulosman/batucada into activity,Paul Osman,2010-09-15T13:47:52Z,paulosman,paulosman,14,8,6
106,batucada,ab541ffed24efa4c346c15150591d10d0a7e6257,Merge branch 'master' into activity,Paul Osman,2010-09-15T03:03:13Z,paulosman,paulosman,4,2,2
107,batucada,73e46658aec97b654c4f1d54925b71ebe01969eb,Rename profile user variable in template context. 'user' is already in context.,Paul Osman,2010-09-15T03:03:05Z,paulosman,paulosman,4,2,2
108,batucada,088a3870b1e095cff351a92a0673b49e443db649,Merge branch 'master' into activity,Paul Osman,2010-09-15T01:24:51Z,paulosman,paulosman,10,6,4
109,batucada,adff037487d705f8caabd1d33b31aec570cedb27,Bumping django version number in requirements.txt,Paul Osman,2010-09-15T01:24:45Z,paulosman,paulosman,2,1,1
110,batucada,182a2f0238739a4f6fc2ab08a80831f787ebf96b,Include links to resources in activity view,Paul Osman,2010-09-15T01:24:04Z,paulosman,paulosman,38,34,4
111,batucada,a8cdf9f68e8737fbcf6eb0f7575c3a1b64952055,Add some basic functionality to the projects app for testing 'create' activities,Paul Osman,2010-09-15T01:13:16Z,paulosman,paulosman,27,25,2
112,batucada,f425d54d79eba2654e36fe3406fae56959d62c37,Coming back from vacation makes you want to do crazy things like scrap all the work in progress you had before vacation.,Paul Osman,2010-09-14T22:37:54Z,paulosman,paulosman,209,113,96
113,batucada,efe536d69fa3775f14acc58d98768127fb27a5c6,Redoing the activity schema stuff. Things will be broken in this branch for a little while.,Paul Osman,2010-08-28T00:54:54Z,paulosman,paulosman,140,89,51
114,batucada,c2915e680ec126a2ec1ad93e946cd86a23f89cd3,Correcting instructions in README.rst,Paul Osman,2010-08-27T18:58:09Z,paulosman,paulosman,8,5,3
115,batucada,3bc93aab0d8df80de4697a246755dce60ab89b9f,User stream feeds now include verbage.,Paul Osman,2010-08-27T11:38:10Z,paulosman,paulosman,88,65,23
116,batucada,289bd1edf7b1fc476c1092b5559b49c186c249fb,Make profile urls /locale/username/,Paul Osman,2010-08-27T11:37:07Z,paulosman,paulosman,2,2,0
117,batucada,d518427631b64484afe5e6742523bc1f88e4a9c1,Change path for feeds (this will probably happen a few times) and adding a simple view for rendering a single activity,Paul Osman,2010-08-27T11:35:12Z,paulosman,paulosman,25,22,3
118,batucada,ab106061b1fbce9988f061f767035c32ceff75d0,Display some activities on the dashboard. Useful while developing the feature,Paul Osman,2010-08-26T01:52:28Z,paulosman,paulosman,63,53,10
119,batucada,b6a58dea162aa3f1c1cad6327fceefc1a28c5a80,Fix bug in relationship views due to refactoring of models,Paul Osman,2010-08-26T01:51:07Z,paulosman,paulosman,6,3,3
120,batucada,069fe808d8aa58acb96d72e029bcaf137b5ee88c,"Creating a simple projects model to test against a variety of activity types (following user, following project, creating project, etc)",Paul Osman,2010-08-26T01:25:11Z,paulosman,paulosman,23,23,0
121,batucada,1a4d28b39ff9b21bf8d23ab653a637f10991ee5d,Filter for user objects,Paul Osman,2010-08-26T00:30:30Z,paulosman,paulosman,8,6,2
122,batucada,0e52e05023ea99bd06db57f406947fc8ea031c78,"Make relationship model type neutral (going to reuse for users following projects, etc)",Paul Osman,2010-08-25T21:27:00Z,paulosman,paulosman,78,42,36
123,batucada,abbba4d44fed75ab1d00ca9ec0eb07bcb5161b4b,Work in progress on adding activity streams with atom feeds,Paul Osman,2010-08-25T19:02:33Z,paulosman,paulosman,165,163,2
124,batucada,6efc511633e19fff3d998d4cfbb902e98e5a6e45,Remove some crap from settings.py.,Paul Osman,2010-08-23T15:32:31Z,paulosman,paulosman,4,0,4
125,batucada,0c08438e8405396912ccfb402786671785cb8690,Get rid of get_relationships_from and get_relationships_to. Replace with more intuitive methods in a User class mixin,Paul Osman,2010-08-21T02:25:37Z,paulosman,paulosman,54,24,30
126,batucada,f250680963552d030e15cc6aa20d67e1784890b5,Accidentally left csrf view middleware commented out in settings.py,Paul Osman,2010-08-20T21:59:35Z,paulosman,paulosman,2,1,1
127,batucada,0c7deb8a2fb3615d55e9b2cd3a8de12f77fe453f,Placeholder settings for account manager registration,Paul Osman,2010-08-19T18:52:29Z,paulosman,paulosman,9,9,0
128,batucada,230431faa3eec4d21da5029fd88c68a5a1671cd7,Updating batucada to reflect changes in django-accountmanager,Paul Osman,2010-08-19T00:50:27Z,paulosman,paulosman,26,20,6
129,batucada,4dd99ee80977d409fd9797fbc435f7dd3012ed3b,Add accountmanager back in as a separate project,Paul Osman,2010-08-18T02:36:26Z,paulosman,paulosman,7,6,1
130,batucada,78a9fd3735bd9385e87aafa484c921baaac90cee,Merge branch 'accountmanager' of github.com:paulosman/batucada into accountmanager,Paul Osman,2010-08-18T01:04:27Z,paulosman,paulosman,40,0,40
131,batucada,7a926097ea486571b7f9071dde507a5effe20efa,Merge branch 'master' of github.com:paulosman/batucada into accountmanager,Paul Osman,2010-08-18T01:04:10Z,paulosman,paulosman,32,32,0
132,batucada,6f956cf8add6416df981c2e2cccdb20e9e9b4eef,Moving accountmanager app into it's own project,Paul Osman,2010-08-18T00:56:01Z,paulosman,paulosman,40,0,40
133,batucada,e1f2ae35f9a567832a68c0c5c94196199e925c6e,Adding a readme file,Paul Osman,2010-08-16T18:07:44Z,paulosman,paulosman,32,32,0
134,batucada,9df7ba908f033f11fedf928cd9c80a7a504c47d4,Putting pieces together for Mozilla account manager support.,Paul Osman,2010-08-16T01:49:33Z,paulosman,paulosman,51,50,1
135,batucada,d86b013bbe41debe906210290c2871db2ead1279,Adding some tests to the profiles app,Paul Osman,2010-08-13T20:35:00Z,paulosman,paulosman,95,95,0
136,batucada,ef3aaa9e901729f012bb8c979fe23be201a52d9a,Show all profile information on profile page.,Paul Osman,2010-08-11T18:48:53Z,paulosman,paulosman,70,62,8
137,batucada,7385d4ce65570c7fb0d535c4ad0dca793bd8ad8d,"Users can now add interests, skills, links, etc to their profile. Still a work in progress.",Paul Osman,2010-08-11T16:20:05Z,paulosman,paulosman,217,184,33
138,batucada,e525524bdeeda99c12275df01da68485b2cf6e06,"Started growing out of the django-profiles module. Moved profile functionality out of users application and into it's own. Working on creating a more robust profile manager with related data, image, links to other services, etc.",Paul Osman,2010-08-11T02:44:10Z,paulosman,paulosman,541,399,142
139,batucada,2963379c0b93db8e4de8e3b006ca6e7bfbb8b76a,Delete confirmation tokens after they're used.,Paul Osman,2010-08-11T02:30:52Z,paulosman,paulosman,4,1,3
140,batucada,027b00c9963af1ff5522dedd39c28f90787fc1eb,The save method on Form objects doesn't have a commit kwarg like it does on Model objects. Whoops.,Paul Osman,2010-08-11T02:29:49Z,paulosman,paulosman,2,1,1
141,batucada,e0b738c6221522c2c5f85980337ccb15c14452c4,Add some modeladmin classes,Paul Osman,2010-08-09T11:35:16Z,paulosman,paulosman,34,34,0
142,batucada,faad3816afb967c3ef09480eccaa7873ecc4025b,Users must confirm email address ownership on registration. Also working on profiles a bit,Paul Osman,2010-08-09T03:07:15Z,paulosman,paulosman,104,71,33
143,batucada,8b797832c79548bfbd2392bfef565c79a38ca8f1,Cleaning some things up. Folded some code from a separate app into the users app. It was too coupled.,Paul Osman,2010-08-07T22:13:42Z,paulosman,paulosman,587,309,278
144,batucada,ae48e927ea7b15caa38a6c58fad419acef388738,Fixing typo. Missed a close bracket,Paul Osman,2010-08-06T14:42:07Z,paulosman,paulosman,2,1,1
