,reponame,commitid,commitmsg,commitauthor,commitauthordate,comauthorlogin,shaauthorlogin,stats_total,stats_addns,stats_delns
321,galaxy,aac7b10685b5a1d4f570102da4b5795a6e78b60c,Changed word mark content to 'galaxy',Tay Yang Shun,2014-03-05T02:07:03Z,yangshun,yangshun,2,1,1
322,galaxy,3eeddd6d4803a7d99db345ece007f0688c1a23df,Check for 403 instead of 401 on review page because that's the correct error code for this case (fix pending on API side),Andrew Richardson,2014-03-04T20:06:07Z,aricha,aricha,2,1,1
323,galaxy,8e3c2eb673ec8cc4cd0c64cb5c887e003dcc448a,Fixed review localization and optimized dates.js,Andrew Richardson,2014-03-04T19:56:45Z,aricha,aricha,27,16,11
324,galaxy,cda14e89c3a8c1ef454cb4a6444c53072ddf25b8,Refactored button spinner style to be site-wide and work with different button sizes; also fixed style issues from feedback,Andrew Richardson,2014-03-03T22:52:58Z,aricha,aricha,55,33,22
325,galaxy,a4c39c9bf507561c4d756da198d31618aa617bbc,"Added spinners in accept / reject buttons to act as loading indicators when submitting that status change, and added some of the retina spinner assets from zamboni",Andrew Richardson,2014-03-01T00:14:57Z,aricha,aricha,47,37,10
326,galaxy,61c2d6416e5016b4cfccc4fb80872b95dc7407a0,"Added a `title` attribute to review queue dates, and made page title more specific",Andrew Richardson,2014-03-01T02:03:17Z,aricha,aricha,4,2,2
327,galaxy,6d1feecf19c283e139636ebdb0f53cef91c7b3b4,"Simplified relativeDateString to just return a string composed of a single unit (ie. '1 day' instead of '1 day, 1 hour'), and removed tests associated with this removed functionality",Andrew Richardson,2014-03-01T01:59:34Z,aricha,aricha,145,15,130
328,galaxy,bd4a0af87dac7d28be6127a019da75585bcd118e,Fixed uses of *gettext so that they're parse-able,Andrew Richardson,2014-03-01T01:37:35Z,aricha,aricha,34,14,20
329,galaxy,d86bf5ce52338a412144cb3bb5e8fcd71f793607,Removed all empty .done calls to view builders,Andrew Richardson,2014-03-01T00:15:46Z,aricha,aricha,15,5,10
330,galaxy,325472aac4a531c3ec696b522287f519a05be049,"Reduced hackiness of review queue CSS; column widths are now all auto, which looks a bit odd but will do the trick for now",Andrew Richardson,2014-02-28T21:10:53Z,aricha,aricha,24,5,19
331,galaxy,0f0752f32eefdecc214f83c1e37f13fc36d16749,Refactored dates.js to use ngettext for string formatting,Andrew Richardson,2014-02-28T20:56:13Z,aricha,aricha,39,15,24
332,galaxy,811f7547500cc70355c745fbd426a1ea311f16cd,Minor fixes from feedback,Andrew Richardson,2014-02-28T20:20:23Z,aricha,aricha,26,14,12
333,galaxy,4b46c7ffd3b7e0fa7834213106d36a6e440ba8e3,Renamed a variable for clarity,Andrew Richardson,2014-02-28T06:42:44Z,aricha,aricha,10,5,5
334,galaxy,e11824340151cce5dcfc49e5c3cf8f936e157404,More cleanup,Andrew Richardson,2014-02-28T06:40:18Z,aricha,aricha,1,0,1
335,galaxy,81c4816335c2666b66252ed9e63c8ba7ff384741,Removed silly debugging code,Andrew Richardson,2014-02-28T06:35:28Z,aricha,aricha,10,3,7
336,galaxy,4c9bb1631b939d626cfdfa78bee45258208762b8,Implemented accepting / rejecting games,Andrew Richardson,2014-02-28T06:17:17Z,aricha,aricha,71,63,8
337,galaxy,5722b474d2037e1fa9ad217ba68d6375378b37df,Cleanup / style fixes,Andrew Richardson,2014-02-28T05:00:53Z,aricha,aricha,3,1,2
338,galaxy,e9292a41b3b68e5ec11d49c95df7b6897eb28a23,"- Fixed various issues with unit counts, dates in the future, and handling years
- Added a bunch more unit tests",Andrew Richardson,2014-02-28T04:54:30Z,aricha,aricha,134,102,32
339,galaxy,a8273e9b1b36b917a8ba31b447de6c00293f3368,"Added dates.js to generate relative date strings, and use that for the review list waiting time; also added basic unit tests",Andrew Richardson,2014-02-28T04:03:20Z,aricha,aricha,188,183,5
340,galaxy,8bd56b5490f44713be6a3c2ce907fd6d04cc8a6c,"Improved review list style, sort games in queue by created date, and display waiting time (currently just shows the raw date, need to implement a relative date formatter)",Andrew Richardson,2014-02-28T02:33:16Z,aricha,aricha,32,22,10
341,galaxy,336d1060b707bd68785b602f1721f7c2e9030496,Fetch review list from the API,Andrew Richardson,2014-02-27T02:43:53Z,aricha,aricha,59,34,25
