,reponame,commitid,commitmsg,commitauthor,commitauthordate,comauthorlogin,shaauthorlogin,stats_total,stats_addns,stats_delns
248,arch-website,3fd061d22a4a00699ac5c2a60af9bed1144e5062,make arch rotatable with the mouse cursor,Josh Marinacci,2018-05-10T18:01:47Z,joshmarinacci,joshmarinacci,27,22,5
249,arch-website,d376e754a10290fae5528e18679bafca73308c44,force the canvas to refresh when the module changes,Josh Marinacci,2018-05-10T17:52:03Z,joshmarinacci,joshmarinacci,6,6,0
250,arch-website,64022ba7251e8e2388031f35232cfff9c0b2bc32,add dragging to the queue editor,Josh Marinacci,2018-05-10T17:46:11Z,joshmarinacci,joshmarinacci,64,47,17
251,arch-website,746798442c7caa7ee6c83d77b25f2629f77656c3,"adjust the queue styles
add searching to the queue editor",Josh Marinacci,2018-05-10T17:20:59Z,joshmarinacci,joshmarinacci,80,63,17
