,reponame,commitid,commitmsg,commitauthor,commitauthordate,comauthorlogin,shaauthorlogin,stats_total,stats_addns,stats_delns
311,amo-validator,c2e64e97d548f84955c92caafeb6d69ae4ca33d2,Fix for bug 623642; updated language packs and associated tests for default chrome manifests,mattbasta,2011-01-07T02:18:18Z,mattbasta,mattbasta,57,34,23
312,amo-validator,e32bfafab61d804c27f52a272748eb224988ec00,Fix for unicode decode errors in error bundler output; bug 621595,mattbasta,2011-01-06T23:14:50Z,mattbasta,mattbasta,43,29,14
313,amo-validator,42781f5f4c3e1c6069810a76ded07b74e4e8be7d,Fix for 622730; Removes properly escaped characters before processing JS,mattbasta,2011-01-06T21:51:45Z,mattbasta,mattbasta,24,15,9
314,amo-validator,3e7f233ffe3b0310fc0049043db257daf0af82c0,Fix for the way the validator deals with paths,mattbasta,2011-01-06T12:08:05Z,mattbasta,mattbasta,59,36,23
315,amo-validator,0f069975b27eedd1f5422eb593281d222b7b1167,Unknown elements in install.rdf are now notices; fix for bug 622617,mattbasta,2011-01-05T22:21:03Z,mattbasta,mattbasta,47,24,23
316,amo-validator,867bee9864bd8e7ef51fade8c3874365f4357780,Removed install.js warning per bug 623306,mattbasta,2011-01-05T19:34:29Z,mattbasta,mattbasta,43,0,43
317,amo-validator,67ebfbb86a9f4df2c0461a1f108e3d1b1b0957d8,Made syntax errors in JS warnings rather than errors,mattbasta,2011-01-05T19:24:36Z,mattbasta,mattbasta,36,18,18
