,reponame,commitid,commitmsg,commitauthor,commitauthordate,comauthorlogin,shaauthorlogin,stats_total,stats_addns,stats_delns
0,mofactor-template,64b374a02f253a44678738f72a494b299bcba8b2,"Update README.md

This feels like a good initial effort",Ross Bruniges,2013-02-04T00:49:40Z,rossbruniges,rossbruniges,19,19,0
1,mofactor-template,d6a996ac08ce390a7f3cd82fe71ebaafb0e66388,"Update CONTRIBUTING.md

Thought this could do with some better fleshing out - and low, I have done so!",Ross Bruniges,2013-02-04T00:11:46Z,rossbruniges,rossbruniges,58,54,4
2,mofactor-template,02c00454be0dbfd46df54b22d271167e0cbd5168,Adding in bare-bones initial files,Ross Bruniges,2013-01-29T11:58:02Z,rossbruniges,rossbruniges,407,407,0
