,reponame,commitid,commitmsg,commitauthor,commitauthordate,comauthorlogin,shaauthorlogin,stats_total,stats_addns,stats_delns
0,addon-registration,9165a7545a2e9b2ffe0857d43ad75f129dd9e3f1,"Merge pull request #16 from jasonthomas/deploy

Fix update_celery typo.",Alexis Metaireau,2013-11-26T17:46:13Z,almet,almet,2,1,1
1,addon-registration,08252abed74e486fc031ec8a30117b1ab1dbe5af,Fix update_celery typo.,Jason Thomas,2013-11-26T17:13:14Z,jasonthomas,jasonthomas,2,1,1
2,addon-registration,a18d96f641a01434a76ef06f16ac9ed3a8609b3b,"Merge pull request #15 from mozilla/bypass-integrity-errors-on-insertion

Bypass integrity errors on insertion",Alexis Metaireau,2013-11-26T16:48:14Z,almet,almet,11,8,3
3,addon-registration,3094719c80127a7a8a5afadb526321349a1b826f,Fix typo,Alexis Métaireau,2013-11-26T16:27:01Z,almet,almet,4,2,2
4,addon-registration,83f6f9ac87358f62b071efb8ddaecc3a0cd7cdc4,Bypass integrity errors when populating the backend,Alexis Métaireau,2013-11-26T16:18:06Z,almet,almet,9,7,2
5,addon-registration,12a2853499d4c117875b35ee7f8549561401c698,"Merge pull request #13 from jasonthomas/requirements

Add additional prod requirements",Alexis Metaireau,2013-11-25T09:01:29Z,almet,almet,29,16,13
6,addon-registration,94120689aec581ed1525bdd76311aa1dbac2c8bc,"Merge pull request #14 from jasonthomas/deploy

Add support for python 2.7 in fabfile.py.",Alexis Metaireau,2013-11-25T08:59:47Z,almet,almet,4,4,0
7,addon-registration,c1d647652d1145105b80a6cf4460e4890c59937b,Add additional requirements for prod.,Jason Thomas,2013-11-21T21:27:22Z,jasonthomas,jasonthomas,1,1,0
8,addon-registration,ebe2da869ef66e8394d673af48ecd5f8a0bc7354,Add support for python 2.7.,Jason Thomas,2013-11-21T19:43:52Z,jasonthomas,jasonthomas,4,4,0
9,addon-registration,b6cf4b16d86485ecc581ce340334ca07bbb587b6,Sort requirements/prod.txt,Jason Thomas,2013-11-21T18:54:46Z,jasonthomas,jasonthomas,30,15,15
10,addon-registration,ff992a154d179e1cb6d46819134833ff627bfd42,Add additional prod requirements.,Jason Thomas,2013-11-21T18:53:55Z,jasonthomas,jasonthomas,2,2,0
11,addon-registration,44f5a7dcf85f3ce71dd380155ef1905483094051,Merge branch 'requirements',Alexis Métaireau,2013-11-13T09:26:58Z,almet,almet,6,6,0
12,addon-registration,75c54b6ccc8765345565af745e9e28fe4a3d59c8,Add additional requirements for production deployments.,Jason Thomas,2013-11-08T20:13:19Z,jasonthomas,jasonthomas,6,6,0
13,addon-registration,03edad921d3537514990722f16360a692fbb2aea,add a wsgi file,Alexis Métaireau,2013-11-12T13:23:10Z,almet,almet,6,6,0
14,addon-registration,e25e60308fec349192dcbf35b985e352e91c8244,"Merge pull request #11 from jasonthomas/deploy

Add fabfile.py for code deployments.",Alexis Metaireau,2013-11-12T12:43:35Z,almet,almet,79,79,0
15,addon-registration,78b5abbb6810ba0a7e941a3cb3703189d095ca7b,Add fabfile.py for code deployments.,Jason Thomas,2013-11-08T20:10:55Z,jasonthomas,jasonthomas,79,79,0
16,addon-registration,ebf3db5f7cbfe6159e573fee62e1bb5e806ca039,File rename,Alexis Métaireau,2013-11-04T11:16:14Z,almet,almet,2,1,1
17,addon-registration,39e71e63769519272ac161bca57ec0bce6e6b7c6,Update the README and requirements settings,Alexis Métaireau,2013-11-04T10:17:33Z,almet,almet,14,11,3
18,addon-registration,6b3595183bd8f1a72f685b84502bf47ba97201d3,Add a memcached backend,Alexis Métaireau,2013-10-23T16:06:53Z,almet,almet,67,61,6
19,addon-registration,3347a38a5cefd3580ead5ce1df874592c41d10d6,Refactor the tests so that we can add new backends.,Alexis Métaireau,2013-10-23T15:26:56Z,almet,almet,56,29,27
20,addon-registration,db9307ccbb83f7f1fa18e8de5fe63c937439f09b,create the tables per default,Alexis Métaireau,2013-10-22T14:34:08Z,almet,almet,2,1,1
21,addon-registration,4c6978a3b249b23551ec6dbb13e03ee5c09e4e0c,Add a flag in the config to populate the db.,Alexis Métaireau,2013-10-22T13:15:23Z,almet,almet,20,18,2
22,addon-registration,dcf336ff3d6ff70ea0b98389f1cc1d9fbd11b3f1,Update the readme. Fix #6,Alexis Métaireau,2013-10-22T08:39:34Z,almet,almet,12,9,3
23,addon-registration,8033a91f38652ee61df5e0a003cba18c15c8876e,Add some loadtests,Alexis Métaireau,2013-10-21T16:59:44Z,almet,almet,49,49,0
24,addon-registration,f78e8fb8da424849df5cfec820a00a24ece69cda,"bug 928998 — Add a way to list multiple addons

- Implements a solution for the in memory and raw SQL (using SQLAlchemy
  ORM) backends.
- Add a resource URI where you can POST.",Alexis Métaireau,2013-10-21T16:21:07Z,almet,almet,145,117,28
25,addon-registration,2f85dec6ff0a18b26c11e1e3ef8137e388bfd922,merge with master,Alexis Métaireau,2013-10-21T08:24:01Z,almet,almet,2,1,1
26,addon-registration,2d11f5c06d21b552b808b4bcc5bbb6b95ea0a7ab,"Merge pull request #5 from mozilla/raw-sql-backend

Add a RAW SQL backend (bug 927794)",Alexis Metaireau,2013-10-21T08:17:01Z,almet,almet,147,141,6
27,addon-registration,2cf2c4115a5d6be94d4de252f80f2ee9036018c8,Add a RAW SQL backend (bug 927794),Alexis Métaireau,2013-10-17T17:36:38Z,almet,almet,147,141,6
28,addon-registration,cc149fe3faeb09f54ca25c50e35c8e7c9eafd9b0,Add a RAW SQL backend (bug 927794),Alexis Métaireau,2013-10-17T17:36:38Z,almet,almet,147,141,6
29,addon-registration,8cfb93e16a787891dbc729437e63ac2a87a75310,"Change the way celery bootstraps.

Attach the pyramid registry to the celery app in the pyramid bootstrap, and not in the celery bootstrap itself.

This allows to run the tests with celery_always_eager set to true to be sure everythign is working the right way.",Alexis Métaireau,2013-10-02T10:35:17Z,almet,almet,28,21,7
30,addon-registration,2f15402c0705cc70e5949b8834b9f5881042f622,"Use konfig to read the documentation.

And also make the tasks access to the pyramid registry (so that they can access
the backend they need to work)",Alexis Métaireau,2013-09-30T15:16:36Z,almet,almet,33,26,7
31,addon-registration,9b1c00896aef3c6ab5e01b134f1bdef646df9b90,Try to access the registry from the celery task.,Alexis Métaireau,2013-09-30T14:25:11Z,almet,almet,5,2,3
32,addon-registration,c7d2e68121a7a8e46455271bee5f548657a289fc,"Merge pull request #4 from mozilla/build-fixes

Build fixes",Alexis Metaireau,2013-09-27T11:48:29Z,almet,almet,5,3,2
33,addon-registration,dc66a3c14a4f27556ef890bf0e3befc7b1fe2e20,typo,Tarek Ziade,2013-09-27T11:05:34Z,tarekziade,tarekziade,2,1,1
34,addon-registration,16c360e4bd92bfabe75cd8af4c67e6fb67c0f8fc,added colander,Tarek Ziade,2013-09-27T11:04:35Z,tarekziade,tarekziade,1,1,0
35,addon-registration,164971a8687f70a9dbc03b13675936dd63b6db8e,fixed redis version - fixes #3,Tarek Ziade,2013-09-27T11:02:36Z,tarekziade,tarekziade,2,1,1
36,addon-registration,69a08876e55ebdae22de95155fe7dc78dca7bc5d,fixed flake8 path,Tarek Ziade,2013-09-27T11:02:16Z,tarekziade,tarekziade,2,1,1
37,addon-registration,b6187445c37c479c4262fee75f4eb211e77391f4,Celery is working now,Alexis Métaireau,2013-09-26T15:47:06Z,almet,almet,59,52,7
38,addon-registration,fabde7d0f811eba24da7510a5ae3e09e1262a204,"Update the API to comply with the PRD.

The calls are now POST calls and we check in the body for the values.",Alexis Métaireau,2013-09-26T14:18:01Z,almet,almet,55,25,30
39,addon-registration,c261753957570f030c7ec8b7aa09f1f5ebf0d0ba,"Plug in celery.

Fix #2",Alexis Métaireau,2013-09-26T14:10:37Z,almet,almet,62,61,1
40,addon-registration,43a22deceba5b5c61929c737bea3b493d44cbc7a,update the architecture documentation,Alexis Métaireau,2013-09-25T18:36:45Z,almet,almet,80,23,57
41,addon-registration,21d33738aa7036ab863dc374df58b3f12a41e18b,add documentation about how to start the server,Alexis Métaireau,2013-09-25T18:28:38Z,almet,almet,13,13,0
42,addon-registration,ee17028011c0c362e8765b9feaa9a0820270d6e7,limit coverage to addonreg,Alexis Métaireau,2013-09-25T18:08:33Z,almet,almet,2,2,0
43,addon-registration,d722164037ceb32dd0c03bd0340e85d76acdbb67,update the coveralls badge,Alexis Métaireau,2013-09-25T17:50:35Z,almet,almet,4,2,2
44,addon-registration,0f29c8b1eeeac5f09fdc715bc6a3888ea0ad9bb5,forgot to add the _python backend to git,Alexis Métaireau,2013-09-24T16:52:04Z,almet,almet,23,23,0
45,addon-registration,a5e00def2ba5cdeebfc17e756d416e0ed860e3f7,Add a pure python backend for the tests,Alexis Métaireau,2013-09-24T16:38:44Z,almet,almet,26,24,2
46,addon-registration,5f26b1a8726183fe6e272088077e762242d314ed,Add some test automation tooling,Alexis Métaireau,2013-09-24T16:16:57Z,almet,almet,43,39,4
47,addon-registration,0ab45e27294d2c9225805b9ccc75ff5086e2aeb9,"Fix the tests.

- The PRD says we should return ""id"", not ""addon-id"" or ""addonid"".
- We had an ugly pdb here.
- We don't want pyramid_debug_toolbar in the tests.",Alexis Métaireau,2013-09-24T15:50:56Z,almet,almet,10,6,4
48,addon-registration,fd47624865a76f1ffb7019193b8f97d811b9be1b,pyramid doesn't like dashes,Alexis Métaireau,2013-09-24T15:47:39Z,almet,almet,6,3,3
49,addon-registration,3cab00400c0a296ea86ee91350e2e78b06bb7afa,some tests coverage to test everything is working the way it should,Alexis Métaireau,2013-09-24T15:45:14Z,almet,almet,32,32,0
50,addon-registration,c065d6d2d264ee9c36ed1de215c73c83cda2f997,add the default view,Alexis Métaireau,2013-09-24T15:44:55Z,almet,almet,16,16,0
51,addon-registration,0b7ea9ad5dcb702d7862a0f21f4fe410011c8bca,add the development.ini,Alexis Métaireau,2013-09-24T15:44:36Z,almet,almet,41,41,0
52,addon-registration,dd5a15cfbb9be6f76677a9ecd7f47eb38ae70861,"Bootstrap the cornice webapp.

It's pluggable so it's possible to change the backend to use directly from the
configuration file. This is made to allow easy configuration in the future.

The default implementation will probably be the RAW SQL since that's a small
project. In the future, we could do some more complex stuff, like using caching
strategies.",Alexis Métaireau,2013-09-24T15:41:54Z,almet,almet,32,32,0
53,addon-registration,e329e9dc7701d31dcf89537ad842627eda783b59,"Update the setup.py file.

It now contains deps and the entrypoint needed to run the site with pserve.",Alexis Métaireau,2013-09-24T15:40:22Z,almet,almet,5,3,2
54,addon-registration,79d92123eb6463a43ac68c3f1b49f6060e9a9381,Add a design document to the docs.,Alexis Métaireau,2013-09-24T15:39:29Z,almet,almet,49,49,0
55,addon-registration,86f3a52b4c25226eca0881e180613e545afc49ba,Install the deps from requirements.txt files.,Alexis Métaireau,2013-09-24T15:38:16Z,almet,almet,30,24,6
56,addon-registration,eea275f8d7395bedb758c2becd20a5b4fdadd3f4,update docs,Alexis Métaireau,2013-08-28T14:08:26Z,almet,almet,62,20,42
57,addon-registration,f3d26ee67e9175d21de85d11aae04f9ec00f126e,add a link to Jorge's docs,Alexis Métaireau,2013-08-27T16:55:54Z,almet,almet,4,4,0
58,addon-registration,2b9ba2bf45223a6c92919fa7a9a3576b4d37fd82,put docs requirements in a requirements.txt file,Alexis Métaireau,2013-08-27T16:35:12Z,almet,almet,3,2,1
59,addon-registration,72526b70fb214cf93923f9d82df2d8791d88d5d6,https doesn't use a trusted cert,Alexis Métaireau,2013-08-27T16:33:51Z,almet,almet,2,1,1
60,addon-registration,2bee534b0a6adc495177aada4a5d588faf943463,get the hash of the files,Alexis Métaireau,2013-08-27T16:33:01Z,almet,almet,42,42,0
61,addon-registration,8f742dd1a8f740f276c55b255543bcc2faba5b1b,packaging,Alexis Métaireau,2013-08-27T16:32:14Z,almet,almet,31,31,0
62,addon-registration,91d323f4d77ac329f0228fa9884c84f7474f2078,Makefile to ease things,Alexis Métaireau,2013-08-27T16:31:55Z,almet,almet,16,16,0
63,addon-registration,6d252c9d9e52ecbd5c1876d4973d686569c44c36,add documentation,Alexis Métaireau,2013-08-27T16:31:34Z,almet,almet,274,274,0
64,addon-registration,c9a7d4a81754d613f9165b3ff1cf656f0ebc3fc2,all started with a readme,Alexis Métaireau,2013-08-27T16:31:08Z,almet,almet,8,8,0
