,reponame,commitid,commitmsg,commitauthor,commitauthordate,comauthorlogin,shaauthorlogin,stats_total,stats_addns,stats_delns
311,b2gperf,046c9ccd132fc6375db4526843f6a0b186d45214,Bug 964707 - Use mozversion in b2gperf. r=wlachance,Dave Hunt,2014-01-28T16:20:16Z,davehunt,davehunt,61,13,48
312,b2gperf,910d48e6ebdbf1458431cd19291b198353f163df,Bug 964835 - Allow a machine name to be passed on the command line. r=jgriffin,Dave Hunt,2014-01-28T16:43:11Z,davehunt,davehunt,8,7,1
313,b2gperf,e118ab9a5f0a105ad4a4e6e6fb9092028fc28c58,Bug 926454 - Optionally wipe persistent storage between tests. r=bkelly,Dave Hunt,2013-12-12T12:47:07Z,davehunt,davehunt,34,30,4
314,b2gperf,a778a2c299f37008f10361d686559f319953687a,Bumped version number to 0.14,Dave Hunt,2013-12-13T19:43:14Z,davehunt,davehunt,2,1,1
315,b2gperf,0a3e879b73ed95a42083ed18649f2e759e850292,Add a note that the change log will no longer be updated,Dave Hunt,2013-12-13T19:41:57Z,davehunt,davehunt,4,4,0
316,b2gperf,75b950c038c6197b47f935e52bf393c4af1efa83,Fixed issue with homescreen app frame locator,Dave Hunt,2013-12-13T19:40:19Z,davehunt,davehunt,3,1,2
317,b2gperf,7cc730bb9b719853c77aaeb516e64dacc579c00b,Bump gaiatest to 0.21.2 and b2gpopulate 0.13,Dave Hunt,2013-12-13T19:08:56Z,davehunt,davehunt,22,14,8
318,b2gperf,6343466821ed8a432855e85c12a7036e85899fa4,Create B2GPopulate instances only when needed,Dave Hunt,2013-12-11T11:25:09Z,davehunt,davehunt,8,3,5
319,b2gperf,86ada5949f36dc52a2630bbe0bdb164e8bd81c2a,Bumped version number to 0.13,Dave Hunt,2013-12-12T22:49:20Z,davehunt,davehunt,2,1,1
320,b2gperf,114becb049714da5a94a4404535ef7e5f56f486c,Updated change log for 0.13,Dave Hunt,2013-12-12T22:48:54Z,davehunt,davehunt,6,6,0
321,b2gperf,43ffc888f333fc3808295cbbd5f651983302c82d,Bump gaiatest to 0.20 and b2gpopulate to 0.12,Dave Hunt,2013-12-12T22:38:59Z,davehunt,davehunt,4,2,2
322,b2gperf,704861bc0884c0f5f45ccad8d0ca1dd1d17285fa,Bug 947222 - Get Gaia revision from new app install location. r=bkelly,Dave Hunt,2013-12-11T11:56:47Z,davehunt,davehunt,24,11,13
323,b2gperf,db267894d20924cd273e267de8daf3a5ed565c7b,Bug 946254 - Submit device firmware details to DataZilla. r=bkelly,Dave Hunt,2013-12-11T14:50:09Z,davehunt,davehunt,13,13,0
324,b2gperf,6232bffcfe3683cc255b5464e0e13ba57b73b7af,Added prerequisites with details of getting a Marionette enabled build and connecting to it,Dave Hunt,2013-12-05T22:26:11Z,davehunt,davehunt,8,5,3
325,b2gperf,f7d29ad3bf4cbefd13a41e32fc7877c751d15012,Bug 941557 - Replaced custom log formatter with timestamped mozlog formatter. r=dhunt,Sebastiaan de Haan,2013-11-21T14:56:03Z,Sebastiaan de Haan,Sebastiaan de Haan,17,2,15
326,b2gperf,f70929b92988153dd23df5ef454c68c45020827a,Bug 936071 - Marionette reports homescreen pages as displayed when they're not. r=mdas,Dave Hunt,2013-11-07T18:09:28Z,davehunt,davehunt,10,6,4
327,b2gperf,bd49cf583eff032529aef2882833320c5b2e7cf8,Bumped version number to 0.12,Dave Hunt,2013-11-07T14:45:18Z,davehunt,davehunt,2,1,1
328,b2gperf,6cff7a9e374f686ba9219bffd16bb3364a7a78de,Updated change log for 0.12,Dave Hunt,2013-11-07T14:45:05Z,davehunt,davehunt,4,4,0
329,b2gperf,e72203e4781b217c213b9bcb0bf6d596fc96c985,Bump gaiatest dependency to 0.19 and b2gpopulate dependency to 0.11,Dave Hunt,2013-11-07T14:44:12Z,davehunt,davehunt,4,2,2
330,b2gperf,0093495d30d4aaba67cffb897527f763dd50ee58,Updated change log for 0.11,Dave Hunt,2013-10-15T15:39:15Z,davehunt,davehunt,4,4,0
331,b2gperf,8321c8d0dd15dbf0cb46dd062ef402653ae104b3,Bumped version number to 0.11,Dave Hunt,2013-10-15T15:38:33Z,davehunt,davehunt,2,1,1
332,b2gperf,c685f7a57a58c636809401497f4b2ab14fc0c5fa,Changed homescreen pages locator to work on both 1.2 and 1.3,Dave Hunt,2013-10-15T14:33:24Z,davehunt,davehunt,4,2,2
333,b2gperf,e6bdd19cb85137f4d3df18f884b5f95fd031dc1b,Disable the keyboard first time use screen,Dave Hunt,2013-10-11T11:36:34Z,davehunt,davehunt,3,3,0
334,b2gperf,15cbbd8441e70fd6170a268649f3f00617ba7068,Updated change log for 0.10,Dave Hunt,2013-10-01T11:48:11Z,davehunt,davehunt,7,6,1
335,b2gperf,5b5066a95ed989ef2b5ff7482dce9e098ff1792c,Bumped version number to 0.10,Dave Hunt,2013-10-01T11:46:04Z,davehunt,davehunt,2,1,1
336,b2gperf,be04bf9c2bda812dae64581de955e73ac2d7202f,Improve reliability when waiting for music app to be ready,Dave Hunt,2013-09-30T21:28:51Z,davehunt,davehunt,6,1,5
337,b2gperf,b23a98f4efaedf6a8d629dc6dbd96fe213cb77e1,Move connecting to network inside the test to take advantage of error threshold,Dave Hunt,2013-09-30T21:28:25Z,davehunt,davehunt,8,4,4
338,b2gperf,99a850c7492a3568c0e4ee93d4f0d43901bb65c1,Do not exit testrun when a single test fails,Dave Hunt,2013-09-30T21:27:54Z,davehunt,davehunt,4,2,2
339,b2gperf,0bb680dc0aa8088a87758db928e6eb902592ae36,Bump gaiatest dependency to 0.16,Dave Hunt,2013-09-30T18:11:02Z,davehunt,davehunt,2,1,1
340,b2gperf,842548aa20abdc53e193ed9aea3b144f2129d631,Removed progressbar and added b2gpopulate dependencies,Dave Hunt,2013-09-30T17:21:57Z,davehunt,davehunt,4,2,2
341,b2gperf,770fe1d7525374bd738a5c2849e1fce2217c8432,Added custom launch tests,Dave Hunt,2013-09-30T17:20:36Z,davehunt,davehunt,200,163,37
342,b2gperf,01959c110d8a6628fe013b4846778519e0572390,Refactoring so scroll and launch tests can be more customised,Dave Hunt,2013-09-28T09:17:32Z,davehunt,davehunt,982,545,437
343,b2gperf,f2c20f684113fbdb6c7dabe557850018b8b97274,Updated change log for 0.9,Dave Hunt,2013-09-28T09:30:06Z,davehunt,davehunt,16,16,0
344,b2gperf,d995be2bba289196b435d6fff82458c50e2c2515,Bumped version number to 0.9,Dave Hunt,2013-09-28T09:29:50Z,davehunt,davehunt,2,1,1
345,b2gperf,219bbd8a689f357b21bf971b78cee684ea560361,Output HWComposer FPS values to debug log,Dave Hunt,2013-09-27T13:29:53Z,davehunt,davehunt,1,1,0
346,b2gperf,3aecb8218314d8b6a7bc57951424c891932c8a5a,Move cleanup within error threshold measurements,Dave Hunt,2013-09-27T13:29:24Z,davehunt,davehunt,46,23,23
347,b2gperf,38affbe8811df7f82fe7f4c8a8547957b4f73fa5,Require device name to be provided on the command line,Dave Hunt,2013-09-27T13:28:41Z,davehunt,davehunt,16,7,9
348,b2gperf,993fd575e35d9c984d122eacdb3319b3da26cfee,Improve debug logging for DataZilla fields,Dave Hunt,2013-09-27T13:28:07Z,davehunt,davehunt,6,2,4
349,b2gperf,3b990bd70ff40bdf69a4dafaed91553f6fc29cbe,Fix homescreen scroll fps test and scroll through all pages of apps,Dave Hunt,2013-09-27T08:52:14Z,davehunt,davehunt,34,18,16
350,b2gperf,9c260a5e548efb30e528b148db39a290052578f5,Add video scroll fps test,Dave Hunt,2013-09-27T08:24:02Z,davehunt,davehunt,13,12,1
351,b2gperf,43b89d441c7ebeb78a11d8a071ee8061ee581757,Add music scroll fps test,Dave Hunt,2013-09-27T08:12:05Z,davehunt,davehunt,13,12,1
352,b2gperf,c2bbd3e52fc0ac1a1bb75cd9bf0c13aca2542486,Add messages scroll fps test,Dave Hunt,2013-09-27T07:50:39Z,davehunt,davehunt,12,11,1
353,b2gperf,baa9f426ef7453501cdc08b0c76692f3c4cc8e7e,Improved scrolling in browser app,Dave Hunt,2013-09-27T07:50:10Z,davehunt,davehunt,8,4,4
354,b2gperf,ddbbf22d0759330549f0412014394e70cfcbb8b9,Improved scrolling in contacts app,Dave Hunt,2013-09-27T00:06:53Z,davehunt,davehunt,11,8,3
355,b2gperf,159fe337235bf544167600106ce03f2ee5b8e822,Add gallery scroll fps test,Dave Hunt,2013-09-26T23:36:36Z,davehunt,davehunt,5,4,1
356,b2gperf,45030d2cafc0dfd57ee34d535d6cb97d8b266f9a,Add settings scroll fps test,Dave Hunt,2013-09-26T22:13:04Z,davehunt,davehunt,19,18,1
357,b2gperf,4a9d85e070b9e400a13d44144391bcef7157bde3,Disable the keyboard FTU screen,Dave Hunt,2013-09-26T21:58:50Z,davehunt,davehunt,3,3,0
358,b2gperf,7ffb3d0eccd51b94a11f3b0fbf929fcdb84588df,Add support for gathering FPS measurements from the HWComposer logs,Dave Hunt,2013-09-26T21:58:16Z,davehunt,davehunt,29,28,1
359,b2gperf,8594f26d1c8aed04af8791148d0e48a89a32795e,PEP8 fixes,Dave Hunt,2013-09-26T21:55:06Z,davehunt,davehunt,2,2,0
